Unnamed: 0,ID,Title,Author,Created_UTC,Subreddit,Num_Comments
184,xs7x14,New study finds that top surgery improves quality of life in trans youth | Xtra Magazine,TransgenderSoapbox,1664560686.0,transgender,3
185,i61rq1,Trans teens file class-action suit over Arizona surgery ban,Breaking_Down_Walls,1596903392.0,transgender,6
186,16qcx38,Delhi gets first clinic for transgender people at RML: ‘It’s a safe place and helps us with cheaper transition surgeries’,onnake,1695497095.0,transgender,0
187,jxgxic,Sade’s transgender son proudly shows off gender confirmation surgery scars: ‘They set me free’,HenryHenrietta,1605839993.0,transgender,4
188,kfheph,Federal judge orders Wisconsin to provide surgery to trans inmate,jackmolay,1608280585.0,transgender,10
189,6yexle,"Coming as a total surprise to no one, the Trump administration is re-writing Medicaid rule that would allow states to refuse coverage for HRT, counseling, and surgery.",Enleat,1504695785.0,transgender,67
190,80zg7b,"Transgender surgeries are on the rise, says first study of its kind",AbelBound,1519850853.0,transgender,13
191,ffhkly,"People with marginalized bodies are acutely aware of the consequences of not meeting the standards of physical beauty. Fatphobia, transphobia and ableism are part of our daily realities, especially for women of color. What woman who criticize plastic surgery don't see. Possible paywall",longearsliverspots,1583695562.0,transgender,84
192,7uhn38,A new plastic surgery technique for hip widening,sopcol,1517477754.0,transgender,19
193,2zik0g,"A transgender reporter has stated that ""people who don't have genital surgery shouldn't get human rights coverage""",paula_sutton,1426714522.0,transgender,66
194,l08mdc,B.C. teenager free to move forward with gender-affirming surgery after mother's lawsuit tossed (Canada),MondayToFriday,1611018661.0,transgender,5
195,ae4hpp,House Bill 5 would bar Alaska gender confirmation surgery & HRT coverage,ray25lee,1547018650.0,transgender,23
196,hzzdk2,A transgender female inmate received her gender confirmation surgery after a three-year court battle,jackmolay,1596023630.0,transgender,9
197,4v2cah,IOC rules transgender athletes can take part in Olympics without surgery,PetersonToscano,1469732054.0,transgender,18
198,10aixrg,Hong Kong court hears challenge to law preventing trans people from using toilets of affirmed gender before surgery,CatFlier,1673577920.0,transgender,2
199,zn54rb,Wentworth Star Zoe Terakes Shares News Of Gender-Affirming Surgery: 'I look like me now',CatFlier,1671162151.0,transgender,0
200,bkgr8r,"Iowa Governor, Kim Reynolds, signs bill to restrict medicaid payment of transgender surgeries.",Sorry_for_the_mess,1556938466.0,transgender,16
201,1645t0z,Poilievre says schools should leave LGBTQ issues to parents | His comments come as Conservatives prepare to debate surgery ban for trans children and teens,oychae,1693275837.0,transgender,6
202,3phve6,Transition Surgery Nurse: What It's Really Like To Prep Patients For Sex-Reassignment Surgery,maddykc,1445351563.0,transgender,9
203,m9bji,IRS Allows Sex Change Surgery To Be Tax Deductible For Transgender Taxpayers,rockthisbeach,1321058802.0,transgender,45
204,1gch38,"U.S. Social Security Administration changes policy, now recognizes gender changes *no surgery required*",CaliforniaDTS,1371227340.0,transgender,35
205,jlndo2,‘Born to Be’ Trailer: Documentary About Transgender Surgery Pioneer Dr. Jess Ting,Breaking_Down_Walls,1604168710.0,transgender,5
206,gol5sb,"SCOTUS, Incl. Gorsuch and Kavanaugh, OK's Trans Prisoner's Surgery",way26e,1590160448.0,transgender,9
207,gspqxa,Trans Inmate Will Get Surgery Following Supreme Court Order,jackmolay,1590744697.0,transgender,5
208,jc7zgr,Idaho's transphobic governor spent half a million fighting trans inmate's surgery. The Supreme Court just told him to drop it,jackmolay,1602846963.0,transgender,13
209,qep27u,"Quebec's New Bill Requires Surgery For Birth Certificate Sex Changes, Sparking Backlash",jackmolay,1635069088.0,transgender,3
210,l0m0n3,Gender reassignment surgery Q&A,rejs7,1611070026.0,transgender,0
211,jovxs8,Gina Ortiz Jones loses election after Republicans run transphobic ads claiming she wanted to divert money from military base closures to pay for transgender surgeries,Breaking_Down_Walls,1604627228.0,transgender,12
212,i9ofk7,I’m A Nurse Who Cares For Gender Surgery Patients. Here’s Why I Love It So Much. “It’s terribly lonely to have people know you as an incomplete or incorrect version of yourself.”,Hado0301,1597420259.0,transgender,20
213,mwhczg,ACLU sues to challenge Iowa denial of transgender surgery,Breaking_Down_Walls,1619132739.0,transgender,4
214,sh04c8,"Transgender prisoner in Texas denied gender-affirming surgery, lawyer says",jackmolay,1643632079.0,transgender,0
215,bn0zh9,China 'failing trans people' as young attempt surgery on themselves – study,asterisk2a,1557508630.0,transgender,6
216,us8ku,Alberta's Government plan to reinstate funding for gender-reassignment surgery opposed by Wildrose Leader,ekster,1339191872.0,transgender,53
217,fbbt1l,GoFundMe sees rise in those looking for Top Surgery,blissed_out_cossack,1582979026.0,transgender,4
218,7er5re,Federal judge says Trump administration can’t stop funding sex-reassignment surgeries for military members,AnonymousAurele,1511359626.0,transgender,9
219,74kkrk,Pope Blasts Gender-Confirmation Surgery,whatsthenameyouwant,1507254304.0,transgender,11
220,rl47uz,A Thai trans woman talks about her sex change surgery,Wild_Lawfulness,1640054794.0,transgender,0
221,vlpwd9,Opinion | My top surgery story is an ode to trans and nonbinary joy,jackmolay,1656315350.0,transgender,1
222,1c4mv7y,China transgender clinic does not ‘treat patients’ but addresses gender issues,onnake,1713189446.0,transgender,67
223,8z5yia,The Trans Man Whose Pioneering Surgery Was A State Secret For Decades,tf2manu994,1531696764.0,transgender,8
224,pt3f7m,"After Botched Transgender Surgery, Family Wants FIR against Kolkata Hospital",jackmolay,1632300970.0,transgender,1
225,5jjhr3,Stunning transgender woman shares graphic video of her facial feminisation surgery,renee_maybe,1482320547.0,transgender,21
226,9z7lmb,Goldman Sachs offers staff free sex-change surgery,prezxi,1542836025.0,transgender,10
227,hzzeb0,The Case For Facial Feminization Surgery,jackmolay,1596023727.0,transgender,0
228,220spt,Facial Feminization Surgery FAQ,RoseHelene,1396454585.0,transgender,12
229,jc802u,"Top surgery: Types, cost, preparation, and recovery",jackmolay,1602847055.0,transgender,0
230,p2i1sp,"Citing religious liberty, judge saves doctors from Biden mandate to do transgender surgery",umberdragon,1628703705.0,transgender,7
231,1a3bwz,Transgender Surgery at Sixteen,ManicPixieDreamKarl,1363022933.0,transgender,17
232,1f51oo3,'Terrified:' Transgender South Carolinians file federal lawsuit against H.4624 ,onnake,1725040665.0,transgender,10
233,1dxivl7,Is it transphobic for a cis woman to get top surgery? ,heartadiee,1720365480.0,asktransgender,334
234,1dno1d1,"How to answer: ""So, have your child had any surgeries?""",habannes,1719262212.0,asktransgender,160
235,sm3ik7,Can we please stop saying that FTM surgery is less advanced than MTF surgery?,umberdragon,1644171649.0,asktransgender,120
236,12aolvb,The 2-letter Req for Bottom Surgery is the most asinine ridiculous thing about the surgery,Pure_Mist_S,1680537314.0,asktransgender,117
237,115f4to,"""Regret"" after bottom surgery",rosebeats1,1676726303.0,asktransgender,108
238,14zeqz1,How do people afford hair removal and surgery?,RosabeIls,1689336614.0,asktransgender,272
239,1c7druo,What did people with gender dysphoria do before surgery existed?,Important-Yam3824,1713472292.0,asktransgender,164
240,1cuc5zp,How did it feel when you woke up from bottom surgery?,lolalaythrwy,1715969534.0,asktransgender,97
241,13ock9x,bottom surgery,arimae23,1684719083.0,asktransgender,51
242,15tg9jm,Do transitioning surgeries scare you?,Aggressive_Answer_86,1692257478.0,asktransgender,147
243,15nt9rz,Bottom surgery changed my life: a love letter.💜,mononoke_princessa,1691713218.0,asktransgender,100
244,1413x78,Is transfem bottom surgery generally successful?,emlie808,1685944158.0,asktransgender,123
245,14q65qi,Would all trans people get bottom surgery if it was perfect?,SpilltheGreenTea,1688449235.0,asktransgender,282
246,1dv8c2z,"After MtF surgery, is it safe to have someone ejaculate inside of you? Where does the sperm go?",thatblackpurplefox,1720103537.0,asktransgender,150
247,17w65sd,"My boyfriend doesn’t want me to get bottom surgery, should I break up with him?",ProfessionalLog4879,1700088069.0,asktransgender,148
248,1d3aye0,What's the next stage for gender-affirming surgery?,Ok-Philosopher78,1716985541.0,asktransgender,72
249,197fmq8,How have you all made money for surgeries?,jacob11741,1705342759.0,asktransgender,122
250,1cc4ulf,[NSFW] Is it rude to ask the trans woman I am texting if they have had bottom surgery?,RareDescription3606,1713981316.0,asktransgender,126
251,15p6ics,A surprised bottom surgery.,NinjaJin100,1691851693.0,asktransgender,72
252,15i9ptr,"Why is it ""gender affirming surgery"" and no longer ""sex change surgery""? Why has the latter become offensive?",buzzsawblade,1691178207.0,asktransgender,93
253,hkil3q,MtF vs. FtM facial surgery double standards,rvcat,1593781038.0,asktransgender,143
254,1dfr3kv,My boyfriend called me sick for wanting top surgery (ftm) and compared it to cutting off your own hand,Destiny-Downfall,1718372428.0,asktransgender,163
255,18fy4r5,For transfems: how is sex after bottom surgery?,Larriet,1702311246.0,asktransgender,62
256,1f5wj4u,Has surgery helped you with gender dysphoria?,Akaradrin,1725135672.0,asktransgender,39
257,13bkh0v,What's happening to people who had bottom surgeries in states that banned adult HRT?,o-kay-boomer,1683540364.0,asktransgender,131
258,1ee9c3i,"Ayo, is it normal for weird republican parents to be against your trans gf getting bottom surgery for weird invasive reasons?",cupofwaterbrain,1722178697.0,asktransgender,84
259,1f1iz5t,Post bottom surgery (MTF),NormalPeculiars,1724660209.0,asktransgender,18
260,1b13hga,cis woman getting facial feminization surgery,kogaul,1709009938.0,asktransgender,54
261,19e7z21,MTF Are my fears justified about Bottom surgery?,ExpertPowerful3274,1706068492.0,asktransgender,64
262,1euy18q,TOP SURGERY!!!!,SaigieNoel,1723946022.0,asktransgender,8
263,1dh3vzf,Can cis females get top surgery? ,temporo_wave,1718530057.0,asktransgender,41
264,1djsvm1,Why do some people get their nipples removed during top surgery?,forgetthesolution,1718828176.0,asktransgender,70
265,14t92f3,Trans people without bottom surgery: do you ever experience phantom genital feelings?,Subject_Plum5944,1688740560.0,asktransgender,146
266,1ehjazi,How to respond to ppl. asking me if I had surgery?,sadmochi96,1722525594.0,asktransgender,57
267,1dhc6fn,How do you afford your expensive surgeries?,Fit_Project_6043,1718557722.0,asktransgender,43
268,1610lnw,Is there any reason NOT to get bottom surgery?,PolygonChoke,1692973139.0,asktransgender,125
269,rtvj4t,how accurate is mtf bottom surgery?,Versace-Toaster,1641079545.0,asktransgender,109
270,ncg6rt,"Trans girls without bottom surgery: at home, do you urinate standing up?",incognito_mtf,1621018830.0,asktransgender,326
271,1ef1x6c,HRT and gender affirming surgery in people under 18,Reterence,1722265715.0,asktransgender,51
272,177by46,Do you need a gynecologist after bottom surgery?,questionuwu,1697239951.0,asktransgender,87
273,15wkfgt,Do you ever fully recover from bottom surgery? (MTF),BlueberryNeko_,1692559642.0,asktransgender,93
274,1ernlv7,Why is it impossible to search bottom surgery????,Slurpmonster_sweetie,1723595100.0,asktransgender,28
275,1elntvr,Do all trans women want bottom surgery?,QuickAdministration0,1722965496.0,asktransgender,31
276,1dwlhis,Can I do Adam's apple surgery and voice surgery separately ? ,japan_eater,1720256837.0,asktransgender,3
277,1bgf1dl,MTFs who have had bottom surgery: What is it like?,ValuableHovercraft90,1710620142.0,asktransgender,50
278,ohqjbw,My voice feminization surgery experience after 1 year,Bummiestbum,1625949905.0,asktransgender,84
279,t9jiwp,Should I have sex before bottom surgery?,Depression_Gang_Gang,1646754057.0,asktransgender,92
280,170t2r6,Do trans people who have had genital surgery experience weaker orgasm because some nerves are destroyed ?,Mr_rairkim,1696539313.0,asktransgender,108
281,nvbxj2,"Allies, please don't suggest potential surgeries to your trans friends.",notmuchjustchillin,1623179797.0,asktransgender,60
282,1eynxq9,Am I still trans if I don't want bottom surgery?,yobtspector,1724344538.0,asktransgender,36
283,1b36dpy,Stopping Hormones for Surgery,RADISHK,1709228754.0,asktransgender,37
284,y9f47d,"I’m a cis gay man, but I want to getbottom surgery. Should I?",Logbound,1666313068.0,asktransgender,177
285,1efj85p,Will Project 2025 ban Transgender Affirming Surgeries?,AngryMantra,1722309689.0,asktransgender,25
286,1f2yaai,Gender affirming surgery,LiliumStarGalaxy,1724809178.0,asktransgender,4
287,1ejwn4j,Surgery locations,lgbteamplayer91,1722782005.0,asktransgender,3
288,1f4ezur,Considering bottom surgery MTF. ,fixittrisha,1724969339.0,asktransgender,6
289,11yioea,"[Tw] With active genocide being increasingly likely in the US, is it still worth getting bottom surgery?",irondethimpreza,1679490540.0,asktransgender,159
290,firwgz,Rant: Self acceptance over surgery is a thing now?,miarella,1584229196.0,asktransgender,153
291,16t55lw,voice feminization surgery,Forward_Antelope4792,1695774114.0,asktransgender,43
292,1dmv87o,Surgery ,TheDisneyGeneral,1719173940.0,asktransgender,4
293,18dg4vm,Did hrt make anyone else want bottom surgery when they didn’t before?,IncreaseImpressive91,1702014910.0,asktransgender,74
294,197v89r,Top 5 things you did to feminize your appearance not including hormones and surgery.,anytimeemma,1705383345.0,asktransgender,108
295,1ajk4pf,Why do cis people feel the need to be the authority on trans surgeries?,TvManiac5,1707149407.0,asktransgender,64
296,1cjtecr,Bottom surgery more or less popular in the future?,Alert-Lie3021,1714802371.0,asktransgender,58
297,1el8203,Pregnancy after top surgery? ,kaldoreii,1722916284.0,asktransgender,9
298,1dzj3dz,Surgery regret,MudMaleficent8798,1720573810.0,asktransgender,4
299,1cjkbmy,What surgery’s will,Own-Battle-6179,1714773402.0,asktransgender,20
300,1ep4kaz,Bottom Surgery Questions FTM,Aichomaniac,1723327226.0,asktransgender,6
301,1b1e7ea,Is bottom surgery dangerous?,nessaiguess,1709046812.0,asktransgender,31
302,1chwhef,Voice therapy or Voice surgery?,_Burger_Boi_,1714595666.0,asktransgender,24
303,pkvvbr,What is getting transfem bottom surgery like?,ghostybeebean,1631186539.0,asktransgender,77
304,1dccac1,Electrolysis vs Surgery,AfterConference8579,1717990936.0,asktransgender,10
305,1eumhzk,Bottom Surgery Help,l0v3d4y,1723914035.0,asktransgender,1
306,1eq0va2,Correct surgery???? (NSFW),SureAd3854,1723424965.0,asktransgender,2
307,1e13h3g,Surgery Questions,Sprook-children,1720742131.0,asktransgender,2
308,1epa4fe,Cis woman top surgery?,SeaEntertainment5988,1723343857.0,asktransgender,5
309,1eykmhz,Saving for top surgery,the_odd_one3492,1724336643.0,asktransgender,3
310,1e2foa6,Top surgery ,mopodojo,1720891236.0,asktransgender,1
311,qu64dr,can someone be transgender before or without getting gender reassignment surgery?,rickle-pic,1636944227.0,asktransgender,111
312,1ep81qq,Will reassessment surgery work if you have a really small penis? ,Serfiun,1723337284.0,asktransgender,23
313,15wpr6n,How did transgender people survive throughout human history without modern transition surgeries or modern hormone therapy? No offense intended. Just asking out of curiosity.,Responsible-Way5056,1692572148.0,asktransgender,204
314,1dxhkc3,First date: guy asked me if I’d had any surgeries yet. Is this a red flag?,project-paperclip,1720361880.0,asktransgender,71
315,1aek8sl,Ok so let’s talk bottom surgery,CallsignChippy,1706605735.0,asktransgender,44
316,1dxki34,Thailand MTF surgeries,TheTransBaller,1720369739.0,asktransgender,6
317,1dq9tin,Top surgery tomorrow! ,Warm_Bat_8046,1719544647.0,asktransgender,5
318,18xwx3r,Why do some tramsfem people get breast surgeries? Isn't HRT enough to grow the breast?,und3f1n3d1,1704322812.0,asktransgender,85
319,1canvp7,bottom surgery ,LooseAF,1713824291.0,asktransgender,7
320,1ex3sec,bilateral orchiectomy: post surgery ejaculation?,AlreadyReddit999,1724180176.0,asktransgender,5
321,1ehhedq,Ftm bottom surgery vaginaoctomy ,Fallout_Gay,1722520798.0,asktransgender,4
322,1f4ls04,Nipple sensitivity post top surgery ,pqln,1724989267.0,asktransgender,3
323,1ek7jk0,MTF Bottom Surgery swelling ,thedippyspoon,1722809797.0,asktransgender,3
324,1ebrbkf, How does bottom surgery look? ,Natural_Truth_6263,1721902547.0,asktransgender,8
325,13zjm5i,Who was the youngest person to get bottom surgery?,Big-Year-7439,1685813468.0,asktransgender,75
326,1enp89t,Bottom surgery & Electrolysis,Hefty-Elephant-6044,1723172863.0,asktransgender,2
327,1e8rn8w,Facial feminization surgery question,Due_Elephant908,1721583093.0,asktransgender,4
328,1d973ea,surgeries/procedures,whatisnewyorkair,1717639129.0,asktransgender,4
329,1d7zpik,Should she take her hormones after penis surgery?,phatdissapointment,1717514249.0,asktransgender,22
330,187g3p6,"Hey Chat, how can I get bottom surgery without getting bottom surgery?",t_murphy_studios,1701342550.0,asktransgender,16
331,1bgibiy,Bottom surgery,littlelacegirl,1710629230.0,asktransgender,11
332,1f2y09a,surgery options for non-binary people?,Emergency-Cry-7251,1724808362.0,asktransgender,6
333,1dfifen,What do you refer to bottom surgery as?,ConfusedCarton,1718339214.0,asktransgender,25
334,1dl3kjg,Trans surgery ,Practical-Hawk163,1718975180.0,asktransgender,0
335,153ls1q,HRT after gynecomastia surgery?,Remarkable-Cap-2944,1689744601.0,asktransgender,35
336,1e6qbvb,Possible circumcision and will it affect bottom surgery,mr_9001,1721348049.0,asktransgender,19
337,1dw37dx,top surgery help!!,drpotterxx,1720199912.0,asktransgender,1
338,18d7m11,I heard term Sex Reassignment Surgery would have been changed to Gender Affirming Surgery. If that is true why?,MxQueer,1701988404.0,asktransgender,32
339,1cv3cnc,about bottom surgery ,full_on_broken_egg,1716055740.0,asktransgender,7
340,ia9341,I'm feeling suicidal 6 months post botched surgery,Federal-Tension,1597504561.0,asktransgender,94
341,1dk11lt,Consultation surgery question ,Ok-Magician-6962,1718850947.0,asktransgender,3
342,1azqtfx,Should having therapy for autism and ADHD be a requirement for gender affirming surgery? ,DistantWisteria,1708875643.0,asktransgender,64
343,tp8k4c,[NSFW] Is it stupid to want to get bottom surgery just because of sex?,yeetmageetle,1648341204.0,asktransgender,92
344,cna4xp,My final surgery is scheduled!,tgjer,1565204986.0,asktransgender,37
345,1emy6u5,top surgery in FL,mostlygooning,1723095872.0,asktransgender,0
346,1drb08j,Ftm bottom surgery,Moisthands_yum,1719667079.0,asktransgender,1
347,1bhr716,How did Vocal Surgery impact you? ,No_Ad3823,1710769815.0,asktransgender,25
348,1e6gy0g,Referrals to top surgery?,Ill_Ad6098,1721323467.0,asktransgender,2
349,1aslsaj,Will scoliosis surgery affect my chances for top surgery?,sentient-pumpkins,1708122987.0,asktransgender,1
350,1ewfs74,Need help finding top surgery,MithixM,1724108052.0,asktransgender,1
351,1cwcpd7,Can I have both? (Bottom Surgery),ethendtv,1716202529.0,asktransgender,12
352,1cndo4i,Nullification surgery (amab)?,IAbstainFromSociety,1715197934.0,asktransgender,5
353,15ok34n,Am I still a trans woman if bottom surgery hasn't crossed my mind?,Dogrules23,1691786536.0,asktransgender,96
354,1d3xxlu,Top Surgery,Expert-Pressure-5208,1717052360.0,asktransgender,0
355,1b68tqj,Surgery proof,Historical_Step1501,1709552247.0,asktransgender,9
356,1djcze3,Affording Bottom Surgery,Global-Celery8538,1718780753.0,asktransgender,1
357,10a7dgl,Can a cis guy have bottom surgery?,patttwakkk,1673549624.0,asktransgender,87
358,1eefj8s,chest muscle growth after top surgery,dennisx_,1722194963.0,asktransgender,6
359,1dpn4sj,Discord server for surgeries?,Apprehensive_Peak118,1719480563.0,asktransgender,2
360,1f3kft0,seeking top surgery financial aid resources ,ihatev,1724879264.0,asktransgender,1
361,swq01v,My Experience with Bottom Surgery at Vanderbilt,makingonepostplease,1645322583.0,asktransgender,59
362,1e0fjmr,Surgery access next year ,meowmeow2424,1720669598.0,asktransgender,1
363,1dllsv7,tattoo after top surgery?,eeveelotions,1719025016.0,asktransgender,2
364,1f2za3r,Questions/concerns about Gender Affirming Surgery,GhostOfSummerhall,1724812154.0,asktransgender,1
365,1dvir19,Hair Restoration Surgery Recommendations?,MaddieRose84,1720131130.0,asktransgender,1
366,1c6sdjr,Top Surgery,lazymwango,1713407412.0,asktransgender,3
367,1eie72y,Questions for transmascs pre-top surgery ,Vegetable-Ant3704,1722615451.0,asktransgender,4
368,1dzelf8,Medicare / Bottom Surgery,United_Ad_9008,1720561773.0,asktransgender,0
369,1cc9i6u,Surgery questions,Burnbabyburnt,1713992462.0,asktransgender,2
370,1eh148r,I was wondering how you afford your surgeries?,Aurfo,1722466678.0,asktransgender,13
371,1elos4x,Hairline correction surgery in MA,YukonW,1722967742.0,asktransgender,0
372,1em1fp1,FtM face plastic surgery,Runetheloon,1723000566.0,asktransgender,0
373,1exfmqu,Does Medi-cal cover nullification surgery?,Prestigious_League80,1724211354.0,asktransgender,1
374,11imb1v,Prepping for my son’s top surgery,thewritingwand,1677987134.0,asktransgender,48
375,1djmh85,Tips about pursuing bottom surgery,hterbluc,1718812182.0,asktransgender,6
376,1dn0hlo,Electrolysis for bottom surgery,mjslad,1719188680.0,asktransgender,2
377,1e1qbqc,Therapy requirement for top surgery coverage?,syana_seal,1720812684.0,asktransgender,6
378,1f68bdo,What will my boyfriend need after top surgery? ,368402,1725173549.0,asktransgender,6
379,1e9ykpa,Pain associated with bottom surgery,Ok-Gas6753,1721707715.0,asktransgender,1
380,1ew1nqv,Harvard Study - Please Help Us Shape the Future of Gender Affirming Bottom Surgery!,PRSfellows,1724073718.0,asktransgender,20
381,1cuvfjn,Is it okey if I don’t want bottom surgery? ,DuQuand,1716032508.0,asktransgender,26
382,1d59nhr,MTF Bottom Surgery Requirements ,TeresaSoto99,1717199144.0,asktransgender,4
383,1epustr,Top surgery scheduled in 2 months but family wants me to postpone **advice/insight appreciated**,FinePassenger8,1723408600.0,asktransgender,41
384,1f1eiay,How to abstain during bottom surgery recovery?,sillystring331,1724642418.0,asktransgender,3
385,1cedcma,BDSM after bottom surgery,SyxxFtH8,1714220814.0,asktransgender,6
386,1esfned,How long did bottom surgery prep take you?,DrRaster,1723676952.0,asktransgender,7
387,1deiw4z,Question about surgery cost ,AshkyFemboy,1718229803.0,asktransgender,2
388,1ed7jgr,Top surgery in 4 months!,Juicewrldsdrugs999,1722053322.0,asktransgender,0
389,1cxfgbf,Bidets useful for surgery recovery?,astralsick,1716317303.0,asktransgender,7
390,1dzrlt2,Forehead reduction surgery (MtF),sashaaalunaaa,1720604253.0,asktransgender,2
391,1d5ut89,Health Insurance for Surgery.,AzyLeSmol,1717270284.0,asktransgender,3
392,12nu0bq,Why is facial masculinization surgery not talked about?,AndyGoodw1n,1681616826.0,asktransgender,56
393,1desf4i,Top surgery mental health expectations ,BattyBoom,1718260511.0,asktransgender,5
394,1b8qlzq,Gender affirming surgery ,Campybain,1709804176.0,asktransgender,8
395,1chhwwx,Steps after srs surgery ,sara_of_the_end,1714555896.0,asktransgender,5
396,1dsf4cg,SRS / Bottom Surgery Surgeons?,SergeantSolar,1719791400.0,asktransgender,2
397,1er2ooc,I'm thinking about getting voice feminization surgery ,LavenderMoonlight333,1723538013.0,asktransgender,3
398,1dkit11,Loans for top Surgery.,Zealousideal-Body526,1718908184.0,asktransgender,0
399,1ep0qpm,Number of children gender affirming surgery in Minnesota. ,Independent-Smile-37,1723316739.0,asktransgender,7
400,1c27usa,How does MTF bottom surgery sex work?,Slideitinhoney,1712924771.0,asktransgender,18
401,1bde2aq,Top Surgery,New_Argument3539,1710291103.0,asktransgender,3
402,1eetgrf,Am I entitled for being upset at my parents for being willing to cover all medical costs except transition/surgery?,JazzlikeHovercraft75,1722237918.0,asktransgender,61
403,1d2hktt,Questions about bottom surgery ,ForceForHistory,1716897080.0,asktransgender,2
404,13ukax7,Would it be considered faking it if I didn't get bottom surgery?,sloth_ferret69,1685333057.0,asktransgender,75
405,1cev8qy,after bottom surgery ,AfterConference8579,1714269815.0,asktransgender,2
406,1dh414u,Sex change surgery in Belgrade,nikolaADVANCED,1718530720.0,asktransgender,3
407,17374o3,is it fine to maybe not want a bottom surgery?,Dayo_Daora,1696791984.0,asktransgender,51
408,1c67xq4,"Getting FFS soon. What's a good way to respond if someone I am not out to asks why I'm ""getting surgery"" or why I recently ""had surgery""?",Frenascena,1713354993.0,asktransgender,17
409,1c402q9,"If an MtF had ED prior to bottom surgery, would problems happen after surgery as well?",HornyBiBoi23,1713118545.0,asktransgender,3
410,1dislva,Question about bottom surgery and insurance,BraveReception8880,1718722396.0,asktransgender,6
411,1deavz7,MTF Top Surgery Question,Even_Recipe6310,1718209742.0,asktransgender,0
412,1chyl5l,Private Top Surgery,Vincent-Mango-gh,1714600777.0,asktransgender,1
413,sw7x1t,Actual results after surgery?,ColourfulButWhole,1645269741.0,asktransgender,44
414,1emqpju,How to find a gynecologist after surgery.,spookedfloof,1723073101.0,asktransgender,2
415,1ddm9k4,Thailand FTM bottom surgery help,justaleafonatree,1718132846.0,asktransgender,3
416,1cja7yw,Top surgery NHS,THE-ALTER-909,1714746924.0,asktransgender,0
417,1cbahsg,Ftm bottom surgery ,Full-Mycologist7237,1713893335.0,asktransgender,2
418,1d3sqjy,Top Surgery tips needed!,ScarcityFirm9731,1717033828.0,asktransgender,1
