Unnamed: 0,ID,Title,Author,Created_UTC,Subreddit,Num_Comments
0,1byw23r,Vatican says ‘sex-change’ surgery risks threatening human ‘dignity’,OverallEcho9694,1712577600.0,transgender,195
1,119s49r,"NEW study: Regret After Gender Affirming Surgery. Out of 1989 individuals, 6 (0.3%) requested reversal surgery or detransitioned.",jackmolay,1677138940.0,transgender,55
2,1dtzhe6,White House issues statement opposing gender-affirming surgery for minors,onnake,1719961713.0,transgender,92
3,1dzvhda,Japan High Court OKs gender change without surgery,HiddenJasmine,1720617239.0,transgender,16
4,1drrozb,Biden Administration Opposes Surgery for Transgender Minors ,Scary_Towel268,1719715706.0,transgender,52
5,1cwfz91,Trans teen ‘attempts self-mastectomy’ while waiting for surgery in ‘act of desperation’,PinkNews,1716212777.0,transgender,50
6,1f40qc5,"'Sex-normalising' surgeries on children born intersex are still being performed, motivated by distressed parents and the goal of aligning the child’s appearance with a sex. Researchers say such surgeries should not be done without full informed consent, which makes them inappropriate for children.",rejs7,1724933268.0,transgender,36
7,18szgj6,Some conservatives say transgender people regret surgery. A new study says otherwise,onnake,1703784722.0,transgender,81
8,1d2m6ux,"The Texas Republican 2024 platform says hormones and surgery are ""designed to fake transition"" and names shouldn't be changed until age 26",tuckerlieberman,1716910014.0,transgender,117
9,u46j72,Science Shows that Fewer than 1% Regret Having Gender-affirmation Surgery,jackmolay,1650024269.0,transgender,56
10,1eyfkuw,Arizona Court Rules: Trans Birth Certificates Without Surgery,ohbricki,1724321341.0,transgender,13
11,1ewyakr,Missouri now requires proof of surgery or court order for gender changes on IDs,onnake,1724167150.0,transgender,39
12,1ctu7oz,Transgender 18-year-old attempts surgery on himself at home due to lack of access,catoboros,1715911790.0,transgender,49
13,1cn4kat,Czech court removes surgery requirement for gender transition,onnake,1715174892.0,transgender,13
14,1cdq01s,"Landmark Systematic Review Of Trans Surgery: Regret Rate ""Remarkably Low""",ErinInTheMorning,1714149409.0,transgender,17
15,e92rhp,Transgender surgery: Wisconsin Medicaid will now cover needed surgery,HenryHenrietta,1576041702.0,transgender,25
16,1es8qqv,"""The Unexpected Peace of Gender-Affirming Surgery"" by Amethysta Herrick",tuckerlieberman,1723659283.0,transgender,17
17,1900dud,Democrats save New Hampshire House Republicans' surgery ban for gender-diverse youth,onnake,1704549004.0,transgender,49
18,1e8dusb,Transgender woman filing suit after Iowa refused Medicaid coverage for reassignment surgery,onnake,1721535139.0,transgender,13
19,1dqec7l,Gender-affirming surgeries are mostly performed on cisgender people: 'Bitter irony',jackmolay,1719561499.0,transgender,8
20,ry5860,Judge rules trans inmate with severe dysphoria can’t be denied surgery in historic decision Cristina Nichole Iglesias could become the first trans person to get gender affirming surgery while in federal custody.,Hado0301,1641554356.0,transgender,45
21,1dsvdwm,"Opinion: Trans People Deserve Clarity From NYT, Biden Over Anti-Trans Surgery Statement",ErinInTheMorning,1719846679.0,transgender,18
22,19dzrn0,Transgender regret? Research challenges narratives about gender-affirming surgeries,onnake,1706045856.0,transgender,25
23,1518bt2,Seven things I learned after my gender confirmation surgery,rejs7,1689519354.0,transgender,46
24,1ehhcca,Ontario transgender woman loses fight to have province pay for facial feminization surgery,PuddingFeeling907,1722520642.0,transgender,22
25,1e05fuw,Japanese court approves trans woman’s gender change without surgery ,onnake,1720641858.0,transgender,4
26,104geui,Oklahoma Senator introduces ‘worst anti-trans bill’ banning gender-affirming surgery for under 26s,CatFlier,1672967623.0,transgender,89
27,1c3bb2o,Fox host claims trans youth are just gay kids who were forced to have gender-affirming surgery,OverallEcho9694,1713040054.0,transgender,65
28,1dos6fa,"Biden Officials Pushed to Remove Age Limits for Trans Surgery, Documents Show",jackmolay,1719384527.0,transgender,16
29,1d2ekkp,Gottmik’s stunning All Stars 9 top surgery look sends right-wingers into meltdown,jackmolay,1716885053.0,transgender,24
30,176haxf,"Wisconsin GOP approves transgender sports restrictions, set to outlaw gender-affirming surgery",OverallEcho9694,1697144386.0,transgender,41
31,1e1dow8,Trans Rights Win: Japan Approves Gender Change Without Surgery,ohbricki,1720777693.0,transgender,1
32,1clqfsp,The Country of Iran Subsidizes Gender Reassignment Surgery for People with Gender Dysphoria,thehomelessr0mantic,1715020476.0,transgender,25
33,1er0rpc,Fact check: Will Tim Walz allow trans kids across America to get gender-affirming surgery?,jackmolay,1723530134.0,transgender,25
34,15miucp,"Transgender and nonbinary patients have no regrets about top surgery, small study finds",OverallEcho9694,1691595717.0,transgender,30
35,8u9fn8,"Starbucks Will Now Pay for ‘Top Surgeries,’ Other Cosmetic Procedures for Its Transgender Employees",AbelBound,1530104653.0,transgender,120
36,1765h48,Japan court says requiring surgery for gender switch unconstitutional,Saltedline,1697112678.0,transgender,10
37,17mzva3,Lawsuit alleges UW Hospital surgeons performed gender-affirming surgeries without woman's consent,ZestyLegoSoup,1699031297.0,transgender,45
38,13ktorb,NC Lt. Gov. falsely says clinics performed “transgender surgery” on 5-year-olds,OverallEcho9694,1684401876.0,transgender,43
39,i14wdz,"In a first, hospital vows to ban cosmetic surgeries on intersex infants",Ludosys,1596189509.0,transgender,45
40,1cgn968,Court says state health-care plans can’t exclude gender-affirming surgery,jackmolay,1714463464.0,transgender,13
41,10plwxa,"LGBTQ groups promise lawsuit over new Utah law banning transgender surgeries, treatments",CatFlier,1675132898.0,transgender,54
42,18ynnjp,New Hampshire House passes ban on gender-affirming surgery for minors,OverallEcho9694,1704401671.0,transgender,26
43,1dykq6z,"Trump’s Republican party platform bans taxpayer funding for “sex change surgeries,” undoes Title IX protections, and removes language condemning same-sex marriage",onnake,1720474192.0,transgender,50
44,ux3us9,"Montana bars birth certificate changes, even with surgery",PennysWorthOfTea,1653434426.0,transgender,51
45,17apefr,Top surgery included in leading breast surgery textbook for first time ever,jackmolay,1697631521.0,transgender,0
46,dfso8o,"Transgender surgery linked with better long-term mental health, study shows",HenryHenrietta,1570680786.0,transgender,47
47,curibg,Court Says Idaho Must Provide Gender Confirmation Surgery To Transgender Inmate,Hado0301,1566640421.0,transgender,68
48,1ecrpyy,West Virginia is asking the US Supreme Court to consider transgender surgery Medicaid coverage case,onnake,1722009630.0,transgender,16
49,1eacjwy,Philadelphia health providers bring trans-affirming surgery to Argentina,onnake,1721752962.0,transgender,0
50,jro8s0,B.C. judge blocks transgender teen's gender-affirming surgery after disapproving mother sues,Breaking_Down_Walls,1605026298.0,transgender,66
51,1eaxsxi,New Surgery Guidelines for Trans Health: Must-Know Facts,ohbricki,1721815926.0,transgender,0
52,wafkmp,Sexual Satisfaction After Gender Affirmation Surgery in Transgender Individuals,CureusJournal,1659028615.0,transgender,42
53,ejljgj,Jazz Jennings Shares Scars From Gender Confirmation Surgery To Encourage Self-Love,burset225,1578084669.0,transgender,66
54,o3nhnu,First on CNN: Biden administration moves to make gender confirmation surgery available through Veteran Affairs health care system,fu11m3ta1,1624129746.0,transgender,59
55,ba4c1i,Illinois Medicaid to cover gender reassignment surgery,frozen-solid,1554557601.0,transgender,30
56,1e7ip10,NH Gov. Sununu signs into law trans sports ban and prohibition on gender surgeries for minors ,onnake,1721434705.0,transgender,14
57,1c87a9t,Top surgery is just the beginning.,shado_mag,1713559162.0,transgender,0
58,1cshth0,Exploring Facial Feminization Surgery Options for Trans Women,ohbricki,1715770097.0,transgender,0
59,1b0r7n2,VA again delays decision on transgender surgery options,onnake,1708977963.0,transgender,5
60,1c4vz0e,Ban on gender surgeries for transgender minors clears panel of Ohio lawmakers,clevelanddotcom,1713211364.0,transgender,11
61,o1stdw,[Turkey] Doctor refuses to perform surgery on patient simply because she’s trans: ‘He said his hands got dirty’,CatFlier,1623920973.0,transgender,94
62,1588tt9,"Amid threats, Colorado hospital ends gender-affirming surgeries for adults",OverallEcho9694,1690200455.0,transgender,15
63,14kt38s,Trans Russians panic over proposed gender surgery ban,misana123,1687908355.0,transgender,13
64,a18qyo,Chilean President signs bill that allows transgender people over 14 to legally change their name and gender without surgery,Breaking_Down_Walls,1543428839.0,transgender,63
65,1du9n4l,HRC slams White House over position opposing gender affirming surgeries for minors,jackmolay,1719996590.0,transgender,1
66,1al6ba8,Japan court approves transgender man's request for legal recognition without surgery,onnake,1707321804.0,transgender,3
67,17apfak,A Japan Court Ruled That a Trans Plaintiff Can Change His Legal Gender Without Surgery,jackmolay,1697631594.0,transgender,11
68,o999wk,Trans women sue to overturn Georgia Medicaid ban on gender-affirming surgeries,Breaking_Down_Walls,1624840452.0,transgender,20
69,rvrhey,Lithuania approves bill allowing trans people to change name without surgery,jackmolay,1641292864.0,transgender,15
70,kl3k1e,Popular Nigerian Cross-Dresser Bobrisky to Undergo Sex Reassignment Surgery In Africa's First,ibson7,1609075170.0,transgender,39
71,zax3p0,Activists warn hospital is breaking law by cancelling gender-affirming surgeries for trans patients,WhatzReddit13,1670013980.0,transgender,21
72,1c9io8f,"US book on transgender surgery for young people stirs debate, threats in Japan",onnake,1713708259.0,transgender,8
73,1c1wimq,Ontarian wins legal battle for public funding of gender-affirming surgery argued as 'experimental',Myllicent,1712885192.0,transgender,11
74,194ypw8,Slovakia: Surgery once again a condition for gender change,onnake,1705075873.0,transgender,4
75,1794oh6,Face First: A comprehensive guide to facial Feminization Surgery,Impossible_PhD,1697458824.0,transgender,14
76,1eign91,Trans Iowan sues state for Medicaid coverage of his surgery; gets it 5 years later ,onnake,1722621374.0,transgender,0
77,17vg1t0,A Georgia county is fighting a ruling requiring it to pay for a transgender deputy's surgery,onnake,1700005857.0,transgender,24
78,19fci03,Transgender veterans sue the Department of Veterans Affairs for gender-affirming surgery,OverallEcho9694,1706198121.0,transgender,6
79,18c5sck,Publisher cancels plan to translate U.S. book questioning trans surgery,onnake,1701874795.0,transgender,6
80,1butve3,Hong Kong Amends Surgery Requirements to Change ID Gender Markers,onnake,1712154194.0,transgender,0
81,17ejx84,Calls grow to abolish Japan's surgery requirement for gender change,onnake,1698066292.0,transgender,3
82,13g3ewt,Supreme Court won't review constitutionality of Medicaid coverage ban for trans surgery,Resident_Bid7529,1683941416.0,transgender,13
83,1cg9hgn,Federal appellate court says state health-care plans can’t exclude gender-affirming surgery,onnake,1714422490.0,transgender,2
84,bbhgre,Illinois rolls out plan for Medicaid to cover gender reassignment surgery,MyNameIsGriffon,1554867956.0,transgender,24
85,s8ouzc,Wisconsin Republicans join national effort to ban gender confirmation surgeries for transgender youth,RetroTimeLady,1642701504.0,transgender,26
86,18zbhp2,Ohio Gov. DeWine signs executive order banning gender transition surgeries for minors and announced his plans for strict gatekeeping rules for gender affirming care for minors and adults,OverallEcho9694,1704473612.0,transgender,79
87,15z7isb,"Gender-affirming surgeries in US nearly tripled from 2016 to 2019, study finds",OverallEcho9694,1692805420.0,transgender,15
88,179z31o,Wisconsin Senate poised to give final approval to bill banning gender-affirming surgery,OverallEcho9694,1697551348.0,transgender,12
89,15o458s,"Almost no one who has top surgery regrets it, study says",PinkNews,1691746393.0,transgender,6
90,kyej2j,She-Ra creator shares how lockdown gave them the push to finally have top surgery,jackmolay,1610782188.0,transgender,17
91,o5g0xg,UK trans men ‘let down’ and in ‘extreme distress’ as NHS quietly stops life-changing penis surgery,CatFlier,1624342315.0,transgender,26
92,6zhh1y,A Patient Gets the New Transgender Surgery She Helped Invent,Breaking_Down_Walls,1505156228.0,transgender,55
93,efb0f4,Chinese trans graduates’ fight to get new degree certificates after surgery,HenryHenrietta,1577242514.0,transgender,20
94,1arln75,ACLU sues Children’s Hospital Colorado for halting adult gender-affirming surgeries,onnake,1708019963.0,transgender,2
95,149kp2p,Russian lawmakers vote to ban gender reassignment surgery,misana123,1686780515.0,transgender,8
96,crxp1w,"Bill to allow transgender people to change birth certificate without surgery clears first hurdle in Victoria, Australia.",The-Lazy-Lemur,1566108603.0,transgender,29
97,1bxm7u8,Meet the pioneering trans inmates who got gender-affirming surgery in US prisons,onnake,1712437459.0,transgender,0
98,n2o8do,‘It is life-saving’: Elliot Page reveals happiness at having had top surgery | Elliot Page,jackmolay,1619893760.0,transgender,15
99,1dabrgc,In the country of Georgia the upcoming bill will ban gender reassignment surgery. The bill is about to be discussed in few days,Ok_Connection7680,1717769612.0,transgender,14
100,15oy321,Nebraska judge allows abortion limits and restrictions on gender-affirming surgery,onnake,1691825800.0,transgender,13
101,15ne00m,"Transgender and nonbinary patients have no regrets about top surgery, small study finds",xwing1212,1691677576.0,transgender,7
102,14y717v,Transgender Lawyers In Russia Brace For Proposed Gender Surgery Ban,Ornery-Honeydewer,1689212236.0,transgender,10
103,1c4psoc,Transgender veterans file 2nd lawsuit against Department of Veterans Affairs for gender-affirming surgery coverage,OverallEcho9694,1713196728.0,transgender,2
104,18btwf2,Australian Federal government considers adding gender-affirming surgery to Medicare rebate list,ruchenn,1701830905.0,transgender,4
105,ep7d5q,Surgeons don’t give trans people enough information to prepare for surgery and that may be illegal,FloralAshes,1579117987.0,transgender,40
106,1824m5t,Vivek Ramaswamy and Iowa transgender student face off over transition surgery. How it went:,onnake,1700756028.0,transgender,8
107,154zzqd,Trans men launch legal action over NHS surgery 'failures': 'Left in limbo',OverallEcho9694,1689879831.0,transgender,5
108,115ifoe,Why is Sweden restricting hormone therapy and surgery for trans teens?,GenderPettifogging,1676735896.0,transgender,19
109,163rrdd,ACLU sues over Indiana law blocking gender-affirming surgery for inmates,OverallEcho9694,1693242559.0,transgender,4
110,b5iglr,California transgender man sues Catholic hospital over denial of surgery,4thshift,1553558202.0,transgender,22
111,zksk3,Elizabeth Warren Opposes Sex Reassignment Surgery for Transgendered Inmate,Starry_nights,1347146563.0,transgender,135
112,1daj3yz,Top surgery is just the beginning: On the breadth of working-class trans masculinity in TOPS,shado_mag,1717787582.0,transgender,0
113,ji49zp,Republicans run second anti-LGBTQ ad attacking Texas Democrat over transgender surgery,Breaking_Down_Walls,1603670816.0,transgender,23
114,180ivs0,Transgender Veterans Group Threatens VA with Lawsuit over Yearslong Delay in Covering Surgeries,ggroover97,1700578698.0,transgender,5
115,pffukp,Transgender inmate sues Virginia prison for chest surgery to treat gender dysphoria,Breaking_Down_Walls,1630447002.0,transgender,16
116,52nyif,"Chelsea Manning will receive gender transition surgery, lawyer says",AnonymousAurele,1473814023.0,transgender,56
117,fajqn3,A Hospital Refused to Provide Medically Necessary Surgery Because I Am Transgender,MyNameIsGriffon,1582840588.0,transgender,24
118,i1vgp7,Wanted to say hi :) came out in Febuary no hormones or surgeries yet but also no filters either!!!! Lol,Ashlove79,1596301084.0,transgender,33
119,vj0v1z,Victory! North Carolina to Issue Accurate Birth Certificates for Transgender People Without Requiring Surgery,MyNameIsGriffon,1656001610.0,transgender,14
120,6db7m8,A Revolutionary Surgery Could Finally Let Trans Women Carry Children,LorelaiGilmore,1495734232.0,transgender,50
121,e87j03,New Hampshire teen finally comfortable in her own skin after recent transgender surgery at Mount Sinai Hospital,BlankVerse,1575881898.0,transgender,30
122,152v4or,Intersex surgeries ignite controversy as bans on gender-affirming care continue,OverallEcho9694,1689677590.0,transgender,5
123,14zt4sq,Russian parliament bans gender reassignment surgery for trans people,catoboros,1689371046.0,transgender,3
124,14uv9w1,Created a blog on how important SRS surgery is for us,SalStyles,1688898835.0,transgender,8
125,6n5fn4,The latest: HOUSE REJECTS ATTEMPT TO BAN TRANSGENDER SURGERY FOR TROOPS,joyzyshaw,1499988951.0,transgender,35
126,10vj1im,Hong Kong court strikes down ‘unacceptable’ gender law that forces surgery on trans people,CatFlier,1675719595.0,transgender,9
127,18cz09n,"Beijing court backs trans worker fired for absence while recovering from surgery, orders reinstatement and back wages",onnake,1701965536.0,transgender,6
128,d57p0l,California Bans State-Sponsored Travel to Iowa over Refusal to Provide Medicaid Coverage for Gender-Reassignment Surgeries,HenryHenrietta,1568672505.0,transgender,44
129,52rkp6,"Jill Stein on Twitter: ""Glad @xychelsea is getting gender confirmation surgery. Let's #PardonChelsea + move to trans-inclusive single-payer.""",ElenTheMellon,1473873494.0,transgender,175
130,16yuki6,U.S. Justice Department asks to join case against Houston County [Ga.] over covering transgender deputy's surgery,onnake,1696346082.0,transgender,12
131,147x2h0,A gender-affirming surgery gripped America in 1952: ‘I am your daughter’,onnake,1686602415.0,transgender,4
132,821a41,"Gender reassignment surgeries on the rise in the US, study finds",BlankVerse,1520203728.0,transgender,33
133,8qjxzx,Intersex kids are subjected to dangerous surgeries. California is poised to stop it.,QuirkySpiceBush,1528818098.0,transgender,20
134,ndgvbn,Life-changing trans masculine penis surgery currently unavailable on NHS,CatFlier,1621141101.0,transgender,9
135,hdh654,Tasmania’s ‘controversial’ laws — which make gender optional on birth certificates and end the requirement for transgender people to have sex reassignment surgery for their gender to be recognised — get the nod.,ruchenn,1592783141.0,transgender,70
136,114upva,One night in Bangkok — waking up from my surgery - For folk curious about gender confirmation surgery and the emotions around it,rejs7,1676660631.0,transgender,0
137,135vznb,"'You're killing my kid': Over protests, House advances bill to ban gender surgery for trans teens [North Carolina]",GenderPettifogging,1683051798.0,transgender,24
138,uq172s,"Failed by the system, UK trans man leaps into icy ocean every day to crowdfund for top surgery",CatFlier,1652601347.0,transgender,10
139,1105e38,Hong Kong trans activist Henry Tse fought for the right to be recognised as a man without full surgery – and won,Saltedline,1676170750.0,transgender,3
140,dkuq7s,"Utah transgender nonprofit opens office in Orem, aims to help individuals pay for gender-confirmation surgery",HenryHenrietta,1571629318.0,transgender,11
141,yvy5pd,Trans People Are Seeking Nonbinary Bottom Surgeries,jackmolay,1668521052.0,transgender,1
142,yk6qwh,Elon Musk has had more gender affirming surgeries than most trans people,jackmolay,1667399390.0,transgender,4
143,12vuksa,‘They just go to Thailand’: the long and costly wait for gender-affirming surgery in Australia | [Guardian],Blah-Blah-Blah-2023,1682221845.0,transgender,20
144,11pmq7x,Slovakia made a step that could make it possible to register gender change without surgery,griii2,1678647835.0,transgender,3
145,zkm6r7,The Embodied Transition: Sex After Surgery,TransgenderSoapbox,1670905482.0,transgender,0
146,10s6ukv,Inmate seeking gender-affirming surgery moved to women's prison in Topeka,GenderPettifogging,1675386687.0,transgender,4
147,119731h,"Ohio GOP reintroduces bill banning surgery, hormones for transgender minors",GenderPettifogging,1677090295.0,transgender,2
148,apzwdt,Claire Michelle documents entire confirmation surgery in raw authenticity.,ClosetCD,1550014528.0,transgender,11
149,l14sgv,Romania found guilty in European Court of Human Rights for refusing to recognise trans men without surgery,jackmolay,1611129894.0,transgender,18
150,one9us,Baltimore Doctor Saves Trans Lives With Cutting-Edge Gender Reassignment Surgery – CBS Baltimore,_eveywinters,1626702063.0,transgender,23
151,1y859m,Plastic surgery magazine with an edition almost devoted to trans related surgery,habitsofwaste,1392711451.0,transgender,22
152,8if3mx,P.E.I. to cover gender reconstructive surgeries | CBC News,pm27,1525960916.0,transgender,30
153,5ml9gl,Transgender man sues Catholic hospital for refusing sex transition surgery,AnonymousAurele,1483806668.0,transgender,47
154,153vgiq,Russia bans gender-affirming surgery in attack on trans community | OpenDemocracy,Pantextually,1689774233.0,transgender,0
155,ob34km,U.S. to add 'X' gender marker on passports | No longer requires proof of surgery for gender change.,LEGOLoverPDX,1625077032.0,transgender,32
156,dy70rg,Proof of surgery no longer required to update gender on Michigan Identification!,I_Am_Hazel,1574101196.0,transgender,17
157,16jbj7h,"“Where Is There to Go?” He Needs Gender-Affirming Surgery, but His State Is Fighting to Deny Coverage.",brokegaysonic,1694779630.0,transgender,4
158,xpekzw,Top Surgery and Chest Dysphoria Among Transmasculine and Nonbinary Adolescents and Young Adults,Whatever-Man1,1664279426.0,transgender,5
159,2ekg8e,Obamacare Now Pays for Gender Reassignment Surgery,leelaginelle,1409002525.0,transgender,39
160,vjd09l,LGBT rights in China: transgender youth seeking gender affirming surgery find family approval still biggest hurdle,Saltedline,1656035658.0,transgender,6
161,t72ct4,"Idaho House committee advances bill banning youth transgender surgery, treatments",CatFlier,1646457829.0,transgender,5
162,kqkk8c,California insurance commissioner says companies cannot deny trans youths coverage for chest surgery,Breaking_Down_Walls,1609801824.0,transgender,15
163,seopbm,Facial feminization surgeries for trans women now covered by UPMC,jackmolay,1643369355.0,transgender,3
164,zsdee0,Everything You Need To Know Before You Get Top Surgery,CatFlier,1671686929.0,transgender,0
165,4mkcgu,Trans Model Stav Strashko Doesn’t Want Reassignment Surgery and This is Why,lfinkel,1465075891.0,transgender,51
166,797w47,"Stop Performing Nonconsensual, Medically Unnecessary Surgeries on Young Intersex Children",leelaginelle,1509159812.0,transgender,8
167,yah606,"Tennessee lawmakers' rally against transgender surgery for minors draws supporters, protests",CatFlier,1666423831.0,transgender,3
168,7o79ql,A Transgender Law Student Is Suing His Doctor For Cancelling His Gender Affirmation Surgery,betwixttwolions,1515112105.0,transgender,40
169,lj42hj,Does gender reassignment surgery hurt?,rejs7,1613234897.0,transgender,8
170,j7xyvv,A trans man could receive a penis transplant for the first time as doctors consider ‘quantum leap’ for bottom surgery,jackmolay,1602246252.0,transgender,29
171,7doaow,Pentagon Foots Bill for Soldier's “Gender Transition” Surgery,olpt41,1510955738.0,transgender,18
172,u8dyu7,Court orders US federal prison to provide immediate transgender surgery for inmate | Procedure would be granted for the first time ever,CatFlier,1650510984.0,transgender,15
173,yic31q,Opinion | How come gender-affirming surgeries like mine don’t stir up controversy,jackmolay,1667222605.0,transgender,1
174,otzjm3,Nan proves age is no excuse as she pays for trans granddaughter's voice surgery,jackmolay,1627572059.0,transgender,11
175,8p2g8l,"Jazz Jennings, 17, is about to undergo gender confirmation surgery: Here's what that involves",AbelBound,1528305311.0,transgender,42
176,7d0yyd,Pentagon Pays for Gender Affirmation Surgery Despite Trump's Military Ban,TransgenderU,1510713286.0,transgender,13
177,3m6u4d,Netflix adds gender reassignment surgery to list of staff benefits,jessicat500,1443096270.0,transgender,14
178,ut35gq,Trump Judge Imagines Doctors Forced To Perform Gender Reassignment Surgery On Newborns In Ruling Blocking Trans Health Mandate - Above the Law,jackmolay,1652965969.0,transgender,19
179,11a5sm1,LGBTQ+ Groups Sue Utah for Ban on Gender Affirming Surgery ⋆ The National Center for Lesbian Rights and the ACLU of Utah are coming together in a lawsuit against Utah’s new law banning hormone treatment and gender-affirming surgery for people under 18.,Newsboy13,1677179153.0,transgender,0
180,yz9dk9,"I'm Not Having Gender-Affirming Surgery to Pass, But to See My True Self",jackmolay,1668855681.0,transgender,2
181,r0myga,"Iowa Medicaid denial of transgender surgery unlawful, judge rules (for the second time in 5 years it should be noted)",the-deep-blue-sea,1637700728.0,transgender,1
182,43ak5f,Genital Surgery Must Be Provided To Trans Woman Through Medicare Program,leelaginelle,1454097713.0,transgender,30
183,hypu7z,Trans Neighbours star Georgie Stone says surgery ‘won’t make her character Mackenzie a girl because she already is’,jackmolay,1595845819.0,transgender,8
