Unnamed: 0,ID,Title,Author,Created_UTC,Subreddit,Num_Comments
690,17vlink,Just had bottom surgery!!! AMA,AdCertain6877,1700022191.0,MtF,24
691,16ezjox,6 month surgery update,Vladd88,1694350279.0,MtF,10
692,1cfkbj8,Bottom surgery recommendations ,No_sim,1714346644.0,MtF,2
693,13x24sb,What was your experience with bottom surgery?,Goldgator420,1685576710.0,MtF,44
694,1eys79v,"Made a mistake, cancelled surgery",Artistic-Shape-5153,1724354841.0,ftm,126
695,1eh0mui,"""is it okay if i dont want bottom surgery?""",Aromatic-Wrangler127,1722465435.0,ftm,173
696,1cwm43j,anybody else... NOT feel euphoria after top surgery?,BestBudgie,1716228487.0,ftm,187
697,15gah28,Why is my top surgery $75k?,Sursiq,1690986728.0,ftm,217
698,1cwwlks,top surgery consult went  a bit weird,katsukisshoes,1716256309.0,ftm,152
699,1ec52ax,I want a penis but no surgery,blackskirt56,1721939173.0,ftm,152
700,1eo0rmn,My top surgery was cancelled,Mossyphrog,1723212810.0,ftm,57
701,1chib9v,I’m getting bottom surgery!!!,lxkefox,1714557558.0,ftm,77
702,178g4t4,Top surgery results: swelling or surgical mistake?,Depressedduke,1697378860.0,ftm,185
703,1coi5cb,Y’all’s top surgery reactions??,DenksLewis,1715319524.0,ftm,147
704,1e5omu9,I want top surgery but my partner loves my chest,PublicFroyo2063,1721238765.0,ftm,257
705,1algogq,What was your REAL first thought after waking up from surgery?,18192277,1707347476.0,ftm,473
706,1dwpqw9,What NOT to eat after surgery,Lzr_912918,1720272909.0,ftm,126
707,1d1gxzj,Disguised my top surgery as a reduction! 🥳,absynthe-green,1716775431.0,ftm,53
708,yypmr2,Horrific top surgery experience (Dr. Gallagher in Miami),link1560,1668792587.0,ftm,292
709,1cuig5y,"to trans guys, what was the ""worst"" part of post-top surgery?",calvlio,1715985701.0,ftm,433
710,1dq4g1i,things you all are most excited for post-top surgery?,maleficmaelstrom,1719528436.0,ftm,233
711,12hge8v,3 weeks after top surgery!!,poltnkowka,1681127301.0,ftm,107
712,134ozsa,I’m stripping to pay for my top surgery.,Purpleslutxxx,1682953520.0,ftm,124
713,12rmv8g,my top surgery is in 3hrs arriving at surgery center in about 40mins 🥳,Which_Raccoon8696,1681895443.0,ftm,77
714,1944c1z,Fuck BMI requirements for surgery,Sickly_lips,1704986973.0,ftm,132
715,1ek4mb2,Top surgery under 18?,Mellon_Collie981,1722802249.0,ftm,82
716,18rcxa5,My wife cried when I told her I want lower surgery,transmascadoodle,1703610908.0,ftm,255
717,1c0ee8k,Want a penis but don't want surgery to get one,CringeyCryptid,1712728590.0,ftm,177
718,1eje3qx,For those getting surgery in the future...,twotheclever,1722719533.0,ftm,82
719,q19qz3,Top surgery results!,Numerous_Mango_3571,1633367073.0,ftm,65
720,1dycsm6,top surgery when you actually like your chest?,jumpshipdallas,1720455110.0,ftm,118
721,1d395iz,Waking up during surgery,AC-Hammer,1716979377.0,ftm,75
722,1bvxd80,Stop invalidating trans guys who DON'T plan on bottom surgery. Just STOP!!!,Chronicarus,1712261303.0,ftm,162
723,1bm12rk,does anyone else end up finding top surgery scars hot?,Sea_Towel_5099,1711223340.0,ftm,167
724,1451a13,Got called a ‘selfish bastard’ by my friend because I want top surgery,hedgybaby,1686305544.0,ftm,221
725,180o0bi,unpopular opinion: bottom surgery really isn’t that bad,L0ganbcool,1700592013.0,ftm,99
726,x8aojh,I hate that top surgery scars are only linked to transmascs,throw-away-6823,1662570762.0,ftm,213
727,1775k8c,Why top surgery before bottom surgery?,EssayWide3735,1697222408.0,ftm,83
728,1d3jim7,A question for everyone who has had top surgery ,uhhhhIsuckatnames,1717008105.0,ftm,151
729,1cbkkpp,Just Got Top Surgery Today,thesparklingnoodles,1713918173.0,ftm,42
730,159urxq,how do people feel about nip-less top surgery,K1rbyKat,1690343739.0,ftm,372
731,1d0xh1i,How painful really is top surgery?,PleaseLoveMeFemboys,1716714712.0,ftm,133
732,ozb5uv,Does anyone else have no interest in bottom surgery?,swordslas,1628270368.0,ftm,351
733,1175s6f,Top surgery progress,goomies710,1676897200.0,ftm,57
734,yspfw9,Is it weird to WANT top surgery scars?,GooglyEyeBread,1668206402.0,ftm,184
735,vupe2t,“Did top surgery hurt?” F**king YES!,FloatAwayTheDay,1657327357.0,ftm,156
736,1c0shzm,"Currently hate nipple sensation, can surgery change that? ",anonymouslilegg,1712773234.0,ftm,159
737,14a873j,First chest tattoo post top surgery!,No-Mycologist97,1686849908.0,ftm,61
738,1emgamp,I need a good one-line joke for my top surgery,ashfinsawriter,1723048016.0,ftm,108
739,l93j17,First swim since top surgery! 💦,afabfreedom,1612064123.0,ftm,77
740,16arbas,top surgery got cancelled,ncrranger117,1693927784.0,ftm,45
741,12hram9,1 year post top surgery!,Early_Club2717,1681151018.0,ftm,51
742,15weba9,Cis Boyfriend brought up top surgery costs,No_Potential_1846,1692545199.0,ftm,97
743,1bh3g4h,"If you're getting top surgery, don't see my surgeon",Internal_Fly_4463,1710697159.0,ftm,77
744,137y6di,Anyone else doesn't want bottom surgery?,Charlie_The_Simp,1683230454.0,ftm,191
745,14psuwd,4 years post-op top surgery :),keegbee,1688413777.0,ftm,59
746,1err8js,My sister outed me the night before top surgery ,pastelkitten19,1723605391.0,ftm,44
747,1ecp6ic,what are your thoughts on transitioning without bottom surgery?,Reddit_IsWeird,1722003354.0,ftm,156
748,12tuekj,TOP SURGERY IN 3 HOURS,Celllock,1682063671.0,ftm,92
749,14avv3d,cis people think i had THE surgery,fat_rats_eating_corn,1686919332.0,ftm,70
750,1cej1q3,ACTUALLY getting top surgery!!,ndsmith4926,1714236664.0,ftm,35
751,13zhy37,"If it were acceptable to go shirtless in public, would you still want top surgery?",youburntthetoast,1685809910.0,ftm,536
752,zym0e9,"4 months post-op ""scarless"" top surgery",pakkomi,1672361156.0,ftm,58
753,15xz47w,Is top surgery a “major” surgery?,somuchregretti,1692691872.0,ftm,53
754,1384x1w,Lol I just got Top Surgery,notjackdalton,1683245859.0,ftm,79
755,18iq6a7,I don't like the way artists draw top surgery scars lately,LemonSharkZest,1702609326.0,ftm,136
756,17dndoi,Do you want bottom surgery?,mkcgyeager,1697957971.0,ftm,217
757,15azcap,when did you get top surgery?,small_ego_big_pp,1690457221.0,ftm,179
758,157ld30,Feel like shit about my top surgery scars,mr_bendy_straw,1690134871.0,ftm,85
759,ijdvvx,7 months post top surgery and feeling great 😋,tdd3523,1598799109.0,ftm,106
760,yfxlsw,What should I lie to my professors about getting surgery on?,adrislnk,1666983778.0,ftm,175
761,1bbo2aa,"""THE Surgery""",Ebomb1,1710112156.0,ftm,29
762,13skrne,Almost four weeks post surgery,Addisonbeau22,1685125746.0,ftm,46
763,114c3tt,My Bosses told me they couldn’t accommodate me getting top surgery.,So-queer-I-am-hetero,1676613333.0,ftm,141
764,gxi3hh,Done with top surgery!,CaptainMarzZz,1591408766.0,ftm,62
765,1ejmgkp,Fully got away with saying my top surgery scars were from gyno surgery!,saranwrap73,1722744561.0,ftm,5
766,1dilpv9,What are some absurd but believeable lies I can tell about my top surgery scars to mess with them?,MacuNPekmeZ,1718699528.0,ftm,229
767,1ef4bjk,sex without top surgery??,burneraccount8739,1722271511.0,ftm,51
768,1cpwezh,(Post-Top Surgery) Mom made me show her my chest,Ordinary_Professor93,1715477022.0,ftm,61
769,q97slh,Do you want top surgery scars?,White_Rabbit181,1634372110.0,ftm,301
770,zty6ri,Top Surgery Questions to ask,Appropriate-Deer1713,1671844986.0,ftm,93
771,1cn2c8w,My top surgery got canceled on the way to the hospital,boba-boba,1715168137.0,ftm,45
772,1e6ztxx,Thoughts on referring to Top Surgery as Cosmetic Sugery,kaitokuroballs,1721382304.0,ftm,84
773,106u1y3,how much was yall top surgery???,Negative-Category929,1673211437.0,ftm,289
774,flghsj,COVID-19 Surgery-Related Megathread,AlexaviortheBravier,1584647518.0,ftm,281
775,1cuins1,my top surgery went… too well?,batorija,1715986267.0,ftm,48
776,1cxs402,Top surgery in 2 hours!,hydraulic0,1716353356.0,ftm,46
777,16t6tnl,Guys in their young 20s- how are you affording top surgery?,HomeRepresentative11,1695778309.0,ftm,273
778,1d7rr9r,IN FIVE HOURS I'LL HAVE A MASTECTOMY SURGERY,Racc00n_Tr4sh,1717487758.0,ftm,47
779,1dyty3v,do you think bottom/top surgery will become more advanced any time soon?,TurboMayonnaise,1720500751.0,ftm,106
780,104mewt,Mom types me this letter after I tell her that I am getting top surgery.,MonadoSoyBoi,1672984708.0,ftm,252
781,14iyw4i,Question for folks that underwent top surgery years ago…,throwaway60427805,1687730897.0,ftm,173
782,pbu3tn,Mom suggested plastic surgery,snowonwindow,1629960560.0,ftm,65
783,138wuy5,r/ftm needs to change how it talks about bottom surgery,Like_a_Zubat,1683310667.0,ftm,47
784,yclsmo,"Stoners who have had top surgery, help lol",Aromatic_Wind_6506,1666643460.0,ftm,193
785,zf8as2,Top surgery and coworkers,AmbassadorNew2250,1670435935.0,ftm,77
786,125pq28,Are there more guys here that dont need/want bottom surgery?,pinkmooncloud,1680100157.0,ftm,229
787,1ecrt9f,My mom found out I'm trans after top surgery ,Complex_Data_1600,1722009846.0,ftm,21
788,l35hnb,Plz excuse the mess (3 weeks post final surgery) NSFW,onefriendlyphallo,1611377474.0,ftm,152
789,1cen4r7,Has anyone else kind of accepted they’ll probs never get top surgery?,Frequent_frog,1714247160.0,ftm,110
790,101u2vw,3 years post top surgery with Dr. Medalie😝,weirqueer,1672709064.0,ftm,44
791,10b5pml,t4t relationship and bottom surgery,EmoPrincxss666,1673644368.0,ftm,126
792,z9xbfq,3 yrs post top surgery ☺️,ftmatty,1669923382.0,ftm,48
793,10pzmrh,"4 years after surgery, fulfilling the dream of tattooing my whole chest 💘",Transmanboy,1675173264.0,ftm,99
794,1cti8zl,Post-surgery tips?,TheBaneOfDanes,1715879952.0,ftm,37
795,1b6jv2r,"Whats your opinion on bottom surgery, does anyone else not want to get it?",Best_Egg_6199,1709580770.0,ftm,270
796,undxot,BIPOC 6 months post top surgery!!!!,bladebey1,1652286879.0,ftm,43
797,13zugdw,What’s the first thing you will do/did after top surgery?,Ricecookerless,1685836954.0,ftm,234
798,1e6gq1s,Question for the men who have had Top surgery,PopcornRedditer,1721322917.0,ftm,82
799,13szrmk,Top surgery yesterday!!,lxkefox,1685168057.0,ftm,38
800,tzz8r1,2+ Years Post Top Surgery 👌,Chris__crossing,1649529066.0,ftm,39
801,ydcj1w,Top Surgery Rant.,northern_hare,1666723890.0,ftm,72
802,1ezfe44,Top surgery as a wheelchair user,Background-Papaya123,1724426305.0,ftm,27
803,138wbll,Stop Shitting On Bottom Surgery,aimless_sad_person,1683309527.0,ftm,34
804,myfrvj,3.5 years since top surgery and hormones! 🥳,breakarobot,1619379468.0,ftm,55
805,1entlla,My therapist suddenly changed her mind about writing a top surgery letter.,Thick-Aspect-4404,1723188362.0,ftm,60
806,nbwsy9,"First time swimming since top surgery (1yr 7 mos), first time in the men's locker room, feelin affirmed AF. (top surgery by Dr. Ramineni in DC)",b0bthecat,1620954943.0,ftm,61
807,13iiuwg,My son is getting top surgery,enavr0,1684181212.0,ftm,58
808,szgni8,My son is having top surgery tomorrow,Sugar464,1645620420.0,ftm,115
809,r2pw2m,What do you wish you had for your top-surgery recovery?,Subpar_doodles,1637940506.0,ftm,232
810,urp9ce,"About two years post top surgery NSFW, probably",Ash_TheVirgo,1652802102.0,ftm,49
811,phrim6,Worst thing after surgery imo,Stayfrosty69,1630761930.0,ftm,99
812,15c4djb,They had to add a new policy at the surgery center because of me,thegayleontologist,1690566944.0,ftm,41
813,146wz7v,8 years Top Surgery Post Op.,AnxiousTrans,1686497748.0,ftm,28
814,160bbjv,How much did your top surgery cost?,Dumboratlover,1692904622.0,ftm,142
815,r4k96z,This surgery literally changed my life,MyTransiton,1638150349.0,ftm,43
816,fn1m2v,7 weeks post op top surgery!,drummingplanetfrog,1584891610.0,ftm,65
817,19d0cti,How old were you when you started t and then got gender surgeries,DiligentPie6468,1705942860.0,ftm,263
818,13p5o2o,who here has gotten top surgery without opiates?,virtualbfz,1684794686.0,ftm,159
819,1ele4t5,Top Surgery OR Chest Reduction Surgery?,ViksTeaCorner,1722939558.0,ftm,1
820,wly1mc,I'm so tired of people seriously thinking 5 year olds get hormones and surgery,Impressive_Bus_2635,1660241332.0,ftm,91
821,xyw84b,How are you guys even able to afford surgery?,plipping,1665244599.0,ftm,216
822,qfzc94,I had top surgery today!,iThoughtItWasTrue,1635225509.0,ftm,99
823,10toh00,"Just had top surgery, big chilling",ocean_eyes97,1675537773.0,ftm,51
824,tehfjr,"Tired of hearing that bottom surgery options “aren’t developed yet” or look fake, etc",KieranKelsey,1647321153.0,ftm,242
825,1dmff08,Surgery before top surgery?,Ok_Award4197,1719122278.0,ftm,3
826,yryi8o,A de transitioner sent me a private message and recommended I cancel my top surgery and talk to some detransitioners,Medicalhuman,1668132717.0,ftm,232
827,10voqya,"5 weeks post top surgery, entering pretty boy era",Ok_Faithless_mars,1675733886.0,ftm,53
828,1cak492,Do you actually feel depressed after surgery? ,mighty_dur1an,1713814869.0,ftm,74
829,yj5how,Quick question- Are you happy post T and/or surgery.,acidMan10,1667299815.0,ftm,218
830,joq4je,Top Surgery 11/3/20 with Dr. Garramone,NurseNik,1604607258.0,ftm,59
831,jjxp8w,9 months post keyhole surgery with Dr. Katherine Gast,comfort-borscht,1603923312.0,ftm,86
832,1d2khq2,Bottom Surgery,Behzingagra,1716905652.0,ftm,31
833,1ai647w,Had bottom surgery yesterday!!,clam7,1706994089.0,ftm,30
834,15gc0sa,My bf is getting top surgery,liaradescartes,1690990358.0,ftm,63
835,1eurfhh,Top surgery coming up,Admirable-Ant8149,1723927193.0,ftm,31
836,11q1psp,I hate it when cis people talk shit about trans surgery results,the-frog-monarch,1678687412.0,ftm,49
837,ifmn12,Top Surgery today,nurselegos,1598265749.0,ftm,31
838,158fqpy,"Those who had top surgery, how awake were you after anesthesia???",Ratatouille-objector,1690216712.0,ftm,135
839,10w8qo1,Can a cis woman get top surgery?,CantThinkOfAName874,1675793559.0,ftm,105
840,1eapc8v,i got top surgery last night!!,Either_Independent_7,1721785316.0,ftm,21
841,1ak5ohf,I Hate Top Surgery,Aware-Contest-2407,1707210753.0,ftm,45
842,xwdoko,can i get bottom surgery without top surgery?,knivesforsoup,1664983798.0,ftm,60
843,10plj7a,One year post top surgery!,Comfortable-Speed955,1675131840.0,ftm,32
844,zlots9,I have inheritance money I could use to pay for surgery... But mom says NO!,PunnyPop_EHN,1671018233.0,ftm,187
845,13r4b80,"8 hours before top surgery my mom has decided to offer me $10,000 to not get it 🙃",Justkeeponliving,1684978614.0,ftm,157
846,znqoxp,10 years post-top surgery for those interested,JazzyAndy,1671228933.0,ftm,29
847,yx47rk,Guys who've had top surgery - Did you ask them to weigh them?,ihrie82,1668628501.0,ftm,153
848,lwy0uj,"Today is my one year top surgery anniversary! Peri with Mr Kneeshaw, UK.",linarchery4,1614789169.0,ftm,93
849,1c6hukl,Have to stop T for a month for top surgery.,isayyeetunironically,1713379865.0,ftm,79
850,1459ph3,Didn’t Tell Parents About Surgery,Silhouettes04,1686327831.0,ftm,49
851,15b2nwc,where can i get a thousand dollars ASAP for top surgery?,samiihyan,1690466431.0,ftm,85
852,g7tz95,9 months post top surgery today :),hungryboy283,1587823294.0,ftm,61
853,xvisj8,top surgery,Vegetable_Share_7643,1664899093.0,ftm,63
854,1c0ex8z,Does top surgery count “sex reassignment surgery”?,Chaotic_stupid_bard,1712730556.0,ftm,14
855,11fk9ie,Horrible Top Surgery Consult Experience - Dr. Craig Salt,canklemorris,1677709694.0,ftm,60
856,pw6s4c,6.5 years post top surgery with a tattoo coverup,springbears,1632705796.0,ftm,47
857,1eiajou,Has anyone tried weighing them self before and after surgery?,spideycentses,1722606590.0,ftm,55
858,zrz4ff,"Top surgery 2019, Testosterone 2018",type_o_jordz,1671652829.0,ftm,47
859,v1x8bk,summer reminds me why i will never regret top surgery,eroara,1654022910.0,ftm,99
860,w5k07f,"Am i still ""a guy"" if i dont want bottom surgery?",BerdlyKinnie,1658520408.0,ftm,142
861,audwg4,i get top surgery april 5th guys,Bishounenja,1551049848.0,ftm,68
862,1dapgfa,What other surgery can I say my top surgery is?,parataniwha,1717804266.0,ftm,11
863,1b9zhg9,"To those who've gotten top surgery, where were you emotionally before surgery?",LeftHandersRule,1709932471.0,ftm,27
864,pe1i5t,Negative Top Surgery Experience,Babelincoln1312,1630264057.0,ftm,94
865,13gw57j,Improperly binding can have negative effects on top surgery results,jaxinslacks,1684020589.0,ftm,65
866,q7kf38,Rate my top surgery recovery setup fellas. Advice welcome,crowlich,1634158380.0,ftm,81
867,18mcm90,will t and bottom surgery make me smell rank?,Slothy_0813,1703020197.0,ftm,97
868,1eakn0e,Has anyone had surgery without morphine/opioids?,weezer-_-,1721772544.0,ftm,45
869,11xaseb,How to say I've had a chest related surgery but not out me?,closeted-cryptid,1679386811.0,ftm,140
870,km1ne5,"1 year post op top surgery! (also, first post!)",grandma_cat,1609197769.0,ftm,54
871,c9c7t9,"Hey, wanna hear a joke about top surgery?",DejoMasters,1562304963.0,ftm,40
872,1eenrw3,Health complications after top surgery.,BiGSiS9400,1722217802.0,ftm,14
873,x85z9k,"Just woke up from top surgery, holy shit",Formula1-nerd,1662559453.0,ftm,60
874,1adm0fi,does top surgery hurt?,Ruzzlefluffer,1706500678.0,ftm,56
875,1e5qfmk,Finally got top surgery!!!,rainluvr522,1721243113.0,ftm,22
876,1e4mplp,How much time did you take off work after top surgery?,Hefty-Routine-5966,1721130863.0,ftm,70
877,j9ezdn,"My mother, after my top surgery, begging me to reconsider:",maxxshepard,1602455448.0,ftm,48
878,166sumu,Just got home from top surgery,sandragon_20,1693529955.0,ftm,26
879,1ev2t8n,My top surgery is officially TOMORROW I'm so excited!!,ashfinsawriter,1723962904.0,ftm,31
880,15ranp5,Mom insists i don’t need top surgery because “No one can even notice you have breasts”,cryxbxby,1692055159.0,ftm,100
881,1cur1qq,Bottom surgery ontop of bottom surgery?,zxddit,1716014017.0,ftm,4
882,n4blp4,Top Surgery Documentation on film- 1 month post op,ftmman7,1620087848.0,ftm,52
883,1969wy1,Walking post-bottom surgery,Pyrosagonner,1705215645.0,ftm,28
884,1ejg1r2,The future of bottom surgery,i_cant_sleeeep,1722724842.0,ftm,29
885,16zhdod,Top surgery in Poland results,goofynsilly,1696406971.0,ftm,32
886,nccf5c,I finally got my top surgery yesterday!,angelspook,1621008986.0,ftm,30
887,cbxwe3,"Black, trans, 6 months post top surgery",DBE1234,1562863443.0,ftm,63
888,1f11ocj,Questions about bottom surgery! <3,hxymxnx,1724606580.0,ftm,22
889,yqb1r7,The first thing I will do after top surgery,living_around,1667976315.0,ftm,80
890,1d3rs3e,My parents are against me getting top surgery,nraz15,1717030925.0,ftm,42
891,1366mt3,"Top Surgery Dr. Facque in San Francisco. I'm 15, weigh 122 and am 5'3",goodnightman,1683077380.0,ftm,64
892,hl437w,"4 week surgery update! (Periareolar, w/ vaseline)",blakeol,1593872564.0,ftm,52
893,1e34qpr,Bittersweet Top Surgery ,comic_in_place,1720970177.0,ftm,13
894,1cc4312,Post Surgery Pain Long After Surgery,ResidentCow1285,1713979543.0,ftm,4
895,ccoipv,"Ya boy had top surgery!!!! 1 day post op, updated to follows",Jtatertot92,1563018898.0,ftm,114
896,1509xte,Top surgery healing progress:),su0pursu,1689421559.0,ftm,19
897,13xe11j,Top Surgery Results! (6 days post-op),stupidestiny,1685615560.0,ftm,20
898,16ukmfm,Is there a way to make breasts smaller without surgery?,mysterydevil_,1695918623.0,ftm,109
899,15idvtn,what happens if you have sex or masturbate after top surgery,zephyricle,1691187723.0,ftm,77
900,1f4moq4,Bottom surgery,ratboyballs69,1724992391.0,ftm,5
901,i4qaag,3 years post top surgery with Isak Goodwin,seagrady,1596714189.0,ftm,45
902,1euola0,Who doesn’t want top surgery?,miwo-wen,1723919589.0,ftm,25
903,11lz97n,"Trans man, no interest in top surgery",Sad_Breakfast_4120,1678289390.0,ftm,79
904,1edizbv,Realistically how much chance Is there to damage your chest so much that you can't get top surgery?,Luciferisnotalright,1722094142.0,ftm,70
905,14zclem,Surgery got canceled while I was in the waiting room and my mom said it was God's sign,Ratatouille-objector,1689329991.0,ftm,91
906,1eae65b,Top surgery date!!!,randommusicboy,1721756880.0,ftm,12
907,1e3pmvy,top surgery gave me bottom dysphoria? ,tarsusbitte,1721031948.0,ftm,18
908,10glltr,How did you fund your surgeries?,ReallyDirtyHuman,1674183825.0,ftm,126
909,iilg4y,I’m in love with my new chest! Check out my new video I posted about top surgery recovery https://lifeofsarai.com/2020/08/28/whats-it-like-recovering-from-top-surgery/,srama7,1598671398.0,ftm,56
910,15m6hig,someone commented on my top surgery scars,No_Tie1630,1691560642.0,ftm,36
911,o75t0a,16 Days Post Top Surgery! 🌈,EnbyKai,1624556114.0,ftm,36
912,hnb3km,1 month post top surgery!!,CaptainMarzZz,1594185279.0,ftm,24
913,1996rh6,"For those who have gotten surgery, how did you pay for surgery?",No_Village_5620,1705523216.0,ftm,28
914,16f5qic,Need advice about how to hide my surgery from parents,East-Region-7291,1694366074.0,ftm,71
915,1dyxqps,Painless top surgery,EggGlobal5018,1720515663.0,ftm,14
916,cdoxka,Bottom surgery goals 😍😍😍,verymuchgay,1563232033.0,ftm,33
917,1cz1zz0,I am not excited for my top surgery next week.,WeirdnessRises,1716494084.0,ftm,41
918,1f0yeuz,Top surgery ,elixir_phoenix,1724598258.0,ftm,3
919,vtxrbx,"Started T at 14, got Top Surgery at 16, Hysterectomy at 18. Radiation therapy for Keloid Top Surgery Scars at 20. Ask Me Anything!",yomamama26,1657241107.0,ftm,128
920,1618yt1,Got my hysterectomy yesterday and now I'm doubting if I could get through top surgery,ashfinsawriter,1692992372.0,ftm,206
921,tbwazk,"My top surgery is on tuesday 🥳 let’s celebrate, put some drinks in the chat 🍻🍸🥂",andronaa,1647022424.0,ftm,190
922,1evsxe2,Drain removal after surgery?,Spiffy-and-Tails,1724041127.0,ftm,13
923,11pmagx,"If there was one item you could recommend for top surgery recovery, what would it be?",anxi0usthr0w,1678646840.0,ftm,179
924,15fnser,Feeling alone for wanting bottom surgery,Gothvomitt,1690921685.0,ftm,58
925,1d7ns6n,"Question: just out of curiosity, would you consider bottom surgery?",Responsible-Exit-541,1717472456.0,ftm,74
926,1et08lw,warning for top surgery with dr berli ,miatamariachi,1723740913.0,ftm,22
927,1d8fi3d,Smoking 🍃after top surgery.,Bright_Ad7953,1717555565.0,ftm,27
928,1cnirfp,Getting rejected for surgery due to bmi,TrickyTimeBomb,1715210937.0,ftm,29
929,1cb025j,Gender essentialism and surgeries,tiredprocessor,1713863661.0,ftm,30
930,zjy5cd,I just had top surgery!,cubitumeamus_,1670849349.0,ftm,47
931,153wo9l,My mom says if I get top surgery it will put people off,Tangled_Clouds,1689777090.0,ftm,109
932,113co6h,"5 years post-op top surgery, 8 years in the gym",trophytwunk,1676505879.0,ftm,31
933,1ceh2zp,A bottom surgery special,bitchface-hatchling,1714231536.0,trans,137
934,1czla3n,Celebrating 2 years post-top surgery today!,Delicious-Agency402,1716558816.0,trans,142
935,15r472s,Just had bottom surgery!,Suspicious-Insect-18,1692040833.0,trans,127
936,13b5wva,I had bottom surgery! AMA,rotgbunny,1683500353.0,trans,215
937,1b5ffr9,I got my FFS surgery Friday!!!,psychotic-bubble9,1709466716.0,trans,125
938,1c7512q,surgery has happened 🫶🫶,boxedgum,1713451254.0,trans,59
939,15ahtzy,Not trans... but I want bottom surgery?,Legal_Dimension_3898,1690405658.0,trans,250
940,1dgfag0,I got top surgery on the 10th of june 24♡♡♡,Noah_the_Sergal_boi,1718448559.0,trans,113
941,1cdcnwx,"I’m off to bottom surgery, wish me luckk",tylessa,1714106652.0,trans,120
942,14prqzm,Eeeeee!!! Ya girl is officially booked for bottom surgery!! IM SO EXCITED!!!,The_Batcrab,1688411039.0,trans,351
943,1808z2x,Bored recovering from surgeries,Ritzy_Business,1700542419.0,trans,79
944,16mbx9r,About to head in for my bottom surgery. Wish me luck!!,The_Batcrab,1695082327.0,trans,264
945,1eznvi1,I JUST DESCOVERED THIS SURGERY AND IM SO HAPPY!!,ClosetDemons06,1724447351.0,trans,71
946,1azf7du,finally able to live as my true self! Your girl got top and bottom surgery!,Puggles66,1708835879.0,trans,209
947,159amdp,I’m regretting my bottom surgery.,StealthInPlainSight,1690296510.0,trans,123
948,1481i57,Denied top surgery 5 minutes before it was meant to happen,Axuros,1686614705.0,trans,300
949,1edm9vk,4 years HRT and 3 surgeries!,BrittCD,1722102867.0,trans,38
950,18t4zh3,3 months post surgery and omg… yoga pants!!! Euphoriaaaaa!!!!,The_Batcrab,1703798663.0,trans,107
951,sn9nmy,BOTTOM SURGERY COMPLETE EEEEEEE😸💖,Kitty_Kimz,1644290568.0,trans,100
952,pynshd,Just had pussy surgery pls send love!,MintySpironolactone,1633020570.0,trans,194
953,12enf0f,I officially got bottom surgery [23 MTF 2 years],HaitchCueZed,1680878333.0,trans,122
954,1edcqvx,Why are trans surgeries in the US handled almost carelessly? ,imbutteringmycorn,1722074104.0,trans,170
955,15gu7uq,I’m soooooo excited for my bottom surgery aaaaaAAAAAA!!! 6 weeks away!!,The_Batcrab,1691037787.0,trans,230
956,13vq0cc,Russia bans transgender surgeries,Hidekiflight,1685452447.0,trans,101
957,15w22w5,4 weeks until bottom surgery!! I’m so excited eeeeeeeee!!!,The_Batcrab,1692507907.0,trans,155
958,y803ay,I just had bottom surgery!!,Sprinal,1666178645.0,trans,98
959,17jym1p,Girls after bottom surgery what do you think abt it,somebitchygirl,1698686591.0,trans,174
960,1bl56hh,"Trans men with bottom surgery, can you cum?",Ok-Statement-2217,1711129255.0,trans,77
961,15vczfv,Cis friends telling me not to get facial feminization surgery.,Fauchard1520,1692442070.0,trans,166
962,1cii54f,Just got all my letters for surgery!,margooey,1714662761.0,trans,41
963,1cf8awt,Gf doesn’t want me to have bottom surgery,tjadams1967,1714316202.0,trans,70
964,14b6p6r,3 Years on T and Three Surgeries Later,OnyxInRoyalty,1686946204.0,trans,83
965,16ilgqn,New bottom surgery just dropped,BearJustBarely,1694705480.0,trans,59
966,14jadbb,My first big O after surgery,Gmoore6550,1687764502.0,trans,96
967,1dqiu65,"Fake reasons for ""random"" surgery",Thr0waway0blivi0n,1719578893.0,trans,45
968,1c3jlyo,I want bottom surgery but I'm scared of it,Fractured_Isaac,1713064143.0,trans,123
969,199i6wr,I recently had a revision for my bottom surgery... 🤒,vvelbz,1705554306.0,trans,69
