Unnamed: 0,ID,Title,Author,Created_UTC,Subreddit,Num_Comments
419,1czr9mc,"Why do they talk about ""preventing regret"" all the time for HRT, but not for cosmetic surgeries that are far more irreversible and higher rate of regret? ",Cormier643,1716574234.0,asktransgender,90
420,yss7r5,got a ✨️bottom surgery✨️ date,arimae23,1668213940.0,asktransgender,24
421,1dzzdzv,Surgery in a city far away,weemadness61,1720627217.0,asktransgender,2
422,1ek0peo,Is there a surgery that can change my finger digit ratio?,GraceGal55,1722792485.0,asktransgender,18
423,1eh0vvl,Do you still have periods after ftm bottom surgery?,KonekodenST,1722466075.0,asktransgender,9
424,1elaaud,Post-Bottom Surgery and Kind of Scared? ,The-Locust-God,1722924294.0,asktransgender,2
425,129mngi,This is a genuine question. But why isn't there porn with people that have gotten bottom surgery?,FreeSpeechWins,1680445206.0,asktransgender,97
426,1d3n3fz,top surgery for AMAB enby?,Swidge_,1717017797.0,asktransgender,4
427,1de415z,Question about Surgery Pre-requisite,Environmental_Box121,1718190568.0,asktransgender,2
428,1bursbu,How do transfem climaxes work after bottom surgery ,Flimsy_Rutabaga_3818,1712148614.0,asktransgender,19
429,17g7jm9,So what’s the largest size a transfem can grow to without surgery?,Kanzaso,1698248076.0,asktransgender,72
430,1bhy6zu,Hi! Surgery Question,beasondogwoodstudios,1710787094.0,asktransgender,3
431,1dr5qhd,Ribs damage and top surgery?,garrylenon,1719646090.0,asktransgender,0
432,1bjt008,Bottom surgery?,Slevanas,1710980187.0,asktransgender,1
433,1dsr4lk,Top surgery fluid buildup massage,Spider-Menace24,1719834904.0,asktransgender,0
434,1cegvle,Facial surgery photos. ,victoriamiller66,1714231008.0,asktransgender,1
435,1b28a7r,Top surgery ,Equivalent-Hamster94,1709133028.0,asktransgender,3
436,1eydos0,can i get a surgeries after giving birth?,Bubacekbubu,1724313476.0,asktransgender,3
437,1aen5q8,Ftm top surgery,ERuebz4,1706617287.0,asktransgender,9
438,vub3f8,having a panic attack after surgery,alsuha,1657287764.0,asktransgender,42
439,1ehymk1,Has anyone ever gotten top surgery while in college?,Minky_Mouse_17,1722564945.0,asktransgender,9
440,1eh7kye,Surgery for minors question (mtf 16) doctor recommendations?,Glum-Cause-3333,1722485652.0,asktransgender,5
441,1dcihtb,Transfem Bottom Surgery Care Package Ideas,chouxes01,1718016162.0,asktransgender,5
442,1f13m34,Did anyone feel anxious/dysphoric after first surgery?,Whyevenbother124,1724611486.0,asktransgender,2
443,1btj3is,Travel insurance for surgery ,Gullible_Pin_941,1712013439.0,asktransgender,5
444,17kaaee,Surgery,AbbyNG,1698718024.0,asktransgender,9
445,1bqxmk9,Sex after MtF bottom surgery,Burnbabyburnt,1711740817.0,asktransgender,11
446,18plg0r,How are yall able to take time off work for surgery?,chrissyjoon,1703385194.0,asktransgender,48
447,1cuxldp,Bottom surgery MtF,RoryEngineer,1716039710.0,asktransgender,1
448,1db89x6,My top surgery scars went keloid and ropey. Can I get a scar revision surgery and have a better scar outcome?,plaidragon,1717868275.0,asktransgender,1
449,1c4yxsb,Questions about bottom surgery,kamikazekraken,1713218382.0,asktransgender,4
450,1bhrru6,Surgery in the USA as a EU citizen. Is this for real?,New_Distribution5495,1710771335.0,asktransgender,33
451,1cdw59l,coming out to (extremely) transphobic family before surgery,AdOk4662,1714164438.0,asktransgender,14
452,1dgw0vs,"Mood swings, top surgery and T ",meta_knight_w,1718499143.0,asktransgender,4
453,1eq9ilk,Brow reduction surgery and hair patch/wig,sashaaalunaaa,1723455979.0,asktransgender,0
454,1dekwa4,Top Surgery and Nipples Question,TiredQueerFae,1718235202.0,asktransgender,1
455,1ckz937,Penile inversion Surgery recovery,Cherrybombdbabe,1714937367.0,asktransgender,1
456,1dznqbw,Surgery Referral after DIY HRT (UK),username960240,1720588620.0,asktransgender,1
457,1brwyh4,Top surgery suggestions ,Remarkable-Funny-854,1711844765.0,asktransgender,2
458,1db3mjm,No money for cosmetic surgery,AdPossible7290,1717855270.0,asktransgender,1
459,1euahgb,"FtM people, if you get surgery to get a penis, is it circumcised, not circumcised, or do you get to choose?",LovelyAspen5702,1723873410.0,asktransgender,32
460,18mxoif,"Asking in good faith: Why do some of you use the term ""gender"" reassignment surgery?",dirty_smelly_horny,1703087299.0,asktransgender,74
461,1dqd8ov,Why nobody develops normal shoulder/rib reduction surgeries?,Mitsuha_bro,1719556869.0,asktransgender,10
462,1eitgca,Do friends deserve to know about top surgery?,OldKangaroo1449,1722655850.0,asktransgender,3
463,17ohk4m,Is recovering from bottom surgery scarier than thinking about recovering pre bottom surgery?,Mieww0-0,1699207170.0,asktransgender,7
464,1czy7vw,About top surgery and passability ,Financial_Hunter_544,1716592651.0,asktransgender,2
465,1cndke2,Post-surgery care packages advice,overth1nk1ng1t,1715197673.0,asktransgender,4
466,1cc36m9,Top Surgery Activities Help,Far-Bid-5014,1713977448.0,asktransgender,2
467,1czrci7,How painful is MTF SRS surgery?,Ok_Cardiologist_1141,1716574434.0,asktransgender,4
468,1dvg1o6,AMA - Just had bottom surgery with Dr. Ting,AdriTrap,1720123699.0,asktransgender,10
469,1dlhs16,I got bottom surgery! 🥹,Oatmlik,1719012479.0,MtF,141
470,15a661g,Bottom surgery has changed my life: a love story,mononoke_princessa,1690378769.0,MtF,259
471,1e2anne,Transgender patient denied surgery to appear more feminine. ,Santo-Kong,1720877935.0,MtF,99
472,1cm1sa0,To all the beautiful girlies who had bottom surgery…,Open_Mathematician41,1715050905.0,MtF,136
473,1f1vefk,Sister is disappointed because I do not want bottom surgery,translucentjourney,1724696777.0,MtF,152
474,180lwez,I survived! Just finished bottom surgery 💖,TheRealChupaLupa,1700586527.0,MtF,234
475,1blsjjo,I did it! I had bottom surgery! ,extratalllesbian,1711201562.0,MtF,111
476,1anpga4,I feel so bad after bottom surgery,Ok-Dragonfly-8265,1707596603.0,MtF,125
477,14kpje1,yo what the fuck do they do with the balls after bottom surgery,TheBigTx3,1687899941.0,MtF,345
478,1aywzzc,Biden’s VA won’t fund gender affirming surgery,Electrical-Wrap-3923,1708788073.0,MtF,113
479,1bhpmyg,Getting flagged by TSA after bottom surgery,Tessa167,1710765260.0,MtF,67
480,17l1hrh,"If HRT and surgeries did not exist, would you still transition?",FadedTransWhale,1698803768.0,MtF,326
481,197g2t1,Just had bottom surgery,Jaythekae,1705343794.0,MtF,53
482,15logcs,What people DON'T want you to know about bottom surgery!!,GirlInAPainting,1691515469.0,MtF,151
483,17aq2lq,"GF just got bottom surgery, advice?",Big_Apricot_7461,1697633552.0,MtF,89
484,1cyzd1l,Did any of you ever change your mind about bottom surgery?,Merci_Et_Bonsoir,1716487550.0,MtF,123
485,1clfwd3,Most Desired Type of Surgery?,primostrawberry,1714992020.0,MtF,110
486,qb8utp,Bottom surgery time,Amber_Weird,1634640229.0,MtF,84
487,1cc24gi,Bottom Surgery aside - what's the utility of having an orchiectomy?,PraggyD,1713974981.0,MtF,188
488,t4iayg,how easy do transphobes think it is to get bottom surgery?,Lowerprint,1646168638.0,MtF,185
489,1ctlc6t,Realizing I might want “the surgery”,thecellobelow,1715887534.0,MtF,50
490,15skr4x,Are post bottom surgery vaginas different from cis womens?,mukomime,1692177485.0,MtF,147
491,15h5m1a,How do you girls live happily without surgeries?,AndyGoodw1n,1691072500.0,MtF,168
492,15yqyir,Feeling unlovable without surgery and makeup.,YourDadThinksImCool_,1692758629.0,MtF,129
493,1541hgn,Girlfriend playfully called me “doofus boy” and said that bottom surgery makes her feel uncomfortable,PolygonChoke,1689788048.0,MtF,180
494,173vg8a,"My older brother asked me to ""not to take the drugs and the surgeries.""",Sqid42,1696867245.0,MtF,155
495,zm97gm,Phobic Mom found out I’m getting surgery,Stardust4242,1671069948.0,MtF,124
496,15o3pgl,A new study has found that almost no one who has top surgery regrets it.,PinkNews,1691744848.0,MtF,149
497,1ayyjfq,Gender reassignment surgery,Khalidalmutawaa,1708791947.0,MtF,34
498,15xfjfq,Tried to get advice about bottom surgery. Was told to detransition. Thrice.,Koujow,1692642009.0,MtF,104
499,1etlk75,"I keep being told ""Just do OF"" when I'm sad I can't afford surgery",nerf_irl,1723805206.0,MtF,58
500,18qmsm9,What surgeries if any are on your must have list,Complete_Victory7904,1703524882.0,MtF,221
501,1bvr7l0,Is it bad I don’t want bottom surgery ,stormblade89,1712247182.0,MtF,112
502,o24s6h,I had a funny interaction with airport security while flying home from getting bottom surgery,Super_Pan,1623956229.0,MtF,99
503,o2p571,This girl just got bottom surgery. I’m so happy.,kitaiia,1624023025.0,MtF,113
504,1b7allm,"Good arguments against ""the horrible reality of bottom surgery"" fears?",goldendragon1115,1709658725.0,MtF,122
505,15yzcm1,What's up with people thinking that bottom surgery means cutting your penis off? 🤦‍♀️,Queer_Queein,1692784894.0,MtF,139
506,1ejn18w,"For those people who choose Thailand or any other parts of the world for SRS surgery instead of US and EUROPE due to issues with your budget, are you happy with the outcomes of the surgery? ",TitanusGojira3,1722746574.0,MtF,83
507,1e2a0xl,Post bottom surgery question: anyone else's vag constantly hungry? ,marmeladeshark,1720876070.0,MtF,20
508,1965zyy,"How do I deal with someone referring to bottom surgery as ""chopping it off""?",BatstReddit,1705202129.0,MtF,122
509,1en5vge,Bottom surgery question,Thin-Yam-3902,1723123425.0,MtF,20
510,v0v9le,Would you date a trans girl without bottom surgery,BellaRozalinda,1653897901.0,MtF,276
511,yam0me,1 Month Post Bottom Surgery AMA,LampshadeInTheRain,1666440305.0,MtF,115
512,1azhfhw,"Is it ""bad"" that I just want bottom surgery so I can enjoy sex more?",strangehitman22,1708843581.0,MtF,110
513,1cnqf0r,"My family believes that I should ""make better purchases"" than getting bottom surgery.",dissolvingrainfall,1715235652.0,MtF,59
514,1ex5l2j,For people that went though bottom surgery,ResinRealmsCreations,1724184503.0,MtF,44
515,xe0ug2,Can I still be a girl even if I don't want bottom surgery?,LoudypIg,1663158925.0,MtF,196
516,1afj1zj,Getting Bottom Surgery Even If You Don't Hate Your Parts?,primostrawberry,1706711235.0,MtF,122
517,1dwlgj0,Post-bottom surgery sex question,Any-Neighborhood9757,1720256713.0,MtF,19
518,1cudscg,GUYS IM GETTING SURGERY,booleronii,1715973621.0,MtF,23
519,1f536oc,Facial Surgery,MTF-delightful,1725044429.0,MtF,15
520,p2v38n,Im having bottom surgery tomorrow,LinoMeiso,1628753866.0,MtF,47
521,1epw69g,Just got bottom surgery ,Ruby_of_Void,1723412131.0,MtF,28
522,1d7u302,Surgery over,BlitzDaWolf,1717497808.0,MtF,22
523,165zwb2,Boyfriend isn't comfortable with me getting bottom surgery,Wild_Let_3323,1693452903.0,MtF,70
524,1daz6gt,Surgery Got Canceled,DiligentPart1201,1717839517.0,MtF,17
525,xu5o83,"""you are spending too much money on clothes, jewelry, surgery, beauty products, decorating""",Kampfer84,1664760335.0,MtF,114
526,1bl0apl,About Bottom Surgery,DolphinDoggo,1711116967.0,MtF,33
527,1bgpl41,How in the hell do y'all afford surgery?,Galxcyx,1710651425.0,MtF,76
528,xhxxsq,Bottom surgery in 10 hours. Need positive vibes,kori08,1663550455.0,MtF,69
529,1ef7a3x,Should i sell my Lego collection for gender affirming surgery,HeyItIsInfactMe,1722278592.0,MtF,53
530,1dzsi14,Is it normal to be nervous about bottom surgery?,ResearcherConstant79,1720607708.0,MtF,39
531,14n84lw,Did your desire to get bottom surgery change after starting to transition?,Professional_You_543,1688149623.0,MtF,126
532,197nyf4,Gastroenterologist asked me if I’m getting gender reassignment surgery?,Interesting-Client86,1705362397.0,MtF,48
533,1e092vz,Got Bad News Today About Surgery,Vivid_Steel,1720650809.0,MtF,30
534,ypd2dp,Bottom surgery in less than 10 hours can’t sleep lol,Hour-Sea9903,1667887925.0,MtF,77
535,12tisi4,Is it ok if I don't want gender reassignment surgery?,Jolly-Room4626,1682032897.0,MtF,132
536,14ysy4x,I just had bottom surgery ama,Isley6189,1689274056.0,MtF,82
537,1bacgj8,Just got bottom surgery. AMA I suppose. ,Fotzlichkeit_206,1709970572.0,MtF,57
538,19b7j3e,is it okay if i dont want bottom surgery?,GreenyBon,1705740702.0,MtF,77
539,1eklat3,How does anyone afford the time off from work for bottom surgery?,Bear_Fiend,1722856976.0,MtF,50
540,pw8rsx,trans lesbians and bottom surgery,leftoverbeachsweat,1632713262.0,MtF,72
541,1ewu6ny,Nocturnal Emissions After Bottom Surgery,BeneficialPie3803,1724156752.0,MtF,17
542,1f4vcfv,I'm finally getting bottom surgery :3,skeletalskye,1725024732.0,MtF,15
543,tm94ge,"Yesterday marked 8 months since Sex Reassignment Surgery, AMA",Charlotte_R6,1648127700.0,MtF,93
544,1dw4kl1,Can you wear thongs if you haven't had bottom surgery?,slashpatriarchy,1720203380.0,MtF,61
545,1d0p0uo,Question for lesbian women here who have had bottom surgery,No-Information-8394,1716681636.0,MtF,41
546,10u9h6y,My only fear about bottom surgery,CaptainWildRose,1675592728.0,MtF,81
547,1ezzdct,Surgeries,Whipcreamderp,1724483264.0,MtF,3
548,1bze8k2,Surgery in jeopardy,jormungander,1712622053.0,MtF,28
549,1de12bc,REPLY if you have a strong opinion about getting bottom surgery or not.,Vividlyvicarious3,1718178278.0,MtF,97
550,1f3e1rx,Hrt stop pre surgery,HentaiRobbe,1724861162.0,MtF,12
551,1db8qqb,How the fuck am I ever supposed to afford bottom surgery?,No-Information-8394,1717869581.0,MtF,66
552,15i3cgm,Is this a good enough reason for bottom surgery?,Lizdraxia,1691163437.0,MtF,48
553,pe5xqd,What states mandate coverage of all transgender care/surgeries?,Acceptable-Tie,1630278431.0,MtF,143
554,1bt5657,I’ve decided to get bottom surgery,SalemsTrials,1711981738.0,MtF,32
555,7unymw,WOOHOO! Survived the surgery. Officially living that Vag life!,transtaylork,1517536518.0,MtF,81
556,1dy15k1,Surgery Jitters!!!,Evee_313,1720416918.0,MtF,6
557,w6m5ub,I shouldn't have to get facial surgery just to be accepted,pixie-pixie-pixie,1658633948.0,MtF,87
558,1ddixeq,Bottom surgery is too expensive..,widedisplay7726,1718124705.0,MtF,27
559,1749a01,what do i say to my aunt who thinks hrt and surgery is bodily mutilation,floppyflounders,1696902091.0,MtF,111
560,1f16aqn,Surgery Help,True-Capital-7821,1724618390.0,MtF,2
561,1apwl0e,Hair removal for bottom surgery,NoTechnology1308,1707839271.0,MtF,40
562,tr7581,How are y’all paying for surgeries,FlamenUnicorn,1648571861.0,MtF,141
563,1emv0ys,Is there really 'facially fem' surgery?,otter_femboy,1723085344.0,MtF,15
564,1ehqm78,Surgery,Cute-Programmer-1743,1722543397.0,MtF,0
565,14cu9i3,as a lesbian can you really enjoy sex after bottom surgery?,ThrowRAtranspiv,1687120127.0,MtF,53
566,1eppql1,Bottom surgery in a few days,EmmaKat102722,1723395733.0,MtF,16
567,1dla2r8,How to decide if you want surgery?,DuckInTraining,1718992232.0,MtF,27
568,1ex60sq,Bottom surgery complications ,Ruby_of_Void,1724185544.0,MtF,4
569,1c1sl64,How is everyone affording all this surgery,Ok_Razzmatazz_3757,1712874941.0,MtF,39
570,18l54iw,Does anyone refer to their ass as their pussy before bottom surgery? Or is that weird to do?,Still_I_Smile44,1702893393.0,MtF,129
571,1dcb6yo,Will bottom surgery be banned?,Dizzy_Perception_866,1717987280.0,MtF,23
572,1es2p76,Surgery Date!!!,zoe_phoenix,1723644892.0,MtF,0
573,1e3h0m3,huh so apparently i want to get bottom surgery now,evilgabe,1721002113.0,MtF,14
574,119t05w,Ya girl is getting surgery :3,Erica6502,1677142349.0,MtF,17
575,x6abix,"I really don't like when people generalize ""pre-op trans women"" as if every trans girl was gonna get theSurgery™ or even wants that, while ignoring other surgeries...",ifIcanSee,1662364001.0,MtF,79
576,16myjo9,Bottom surgery,I_Married_Jane,1695148222.0,MtF,21
577,1epinhf,I had top surgery (finally!),amandahailey85,1723375905.0,MtF,6
578,1bv98bw,Yet another friend had the surgery…,Lokael,1712190359.0,MtF,37
579,1f68dib,The more I wear women's underwear the more I want bottom surgery...,what_the_haley,1725173800.0,MtF,18
580,1f5rpr3,Bottom surgery is coming up,tinyfrogface,1725122851.0,MtF,5
581,1bmkk90,Reasons for Bottom Surgery,Drog_Iizjul,1711286314.0,MtF,21
582,1697oy7,As a trans woman is it primarily HRT or bottom surgery that changes how you orgasm?,G__Smith,1693773668.0,MtF,68
583,1e5un8u,Top Surgery ,mac2040,1721253522.0,MtF,1
584,1e731yb,Top surgery ,Desperate-Dig-9389,1721393689.0,MtF,1
585,1crhyfs,is anyone else avoidin surgery & hopin the technological singularity happens & Instant Surgery Stores pop up in malls,petermobeter,1715655397.0,MtF,18
586,1blatrj,Why is surgery so expensive,Nitrix01,1711143284.0,MtF,22
587,1eibetb,Bottom surgery for peference?,Burnbabyburnt,1722608783.0,MtF,5
588,151fiwa,"PSA: There is not ONE way to be Trans, and it is fine to not want any surgeries.",Adventurous-Stallion,1689536697.0,MtF,77
589,v5axz2,I have my bottom surgery in 3 hours with Dr. Toshiro Higuchi in Denver.,RedditUser49642,1654426533.0,MtF,79
590,1dmk8lg,Do you feel phantom pains after bottom surgery ,Natural_Truth_6263,1719142775.0,MtF,21
591,1cogpdo,BOTTOM SURGERY!!!,Royal_Phrase_4798,1715314124.0,MtF,6
592,1e3ebt4,Surgery Question,Altoid_Addict,1720994888.0,MtF,1
593,1enlkt3,Bottom surgery.. help!,Lois_Griffin_91,1723162223.0,MtF,1
594,tyg1pa,"Why are cis people so obsessed with ""the surgery"", and why do they think it's an easy thing to get?",TallGeminiGirl,1649346696.0,MtF,141
595,1e3j76i,Feminizing Surgery w/insurance?,saneter,1721008681.0,MtF,7
596,1dt42ft,Clinic canceled surgery unexpectedly.,painting-Roses,1719867918.0,MtF,3
597,1dcez0d,Bottom Surgery Thoughts,Thin_Pressure4918,1718000959.0,MtF,8
598,1cbvyhf,bottom surgery is ruining my life and i don’t know what to do. please help i’m desperate :(,Right-Zookeepergame7,1713958761.0,MtF,117
599,1btxpmq,I could go buy my dream car but instead I have to save for fucking surgery.,DooB_02,1712061590.0,MtF,64
600,1f5wcfo,What age can I get Bottom Surgery,AwesomeBlox044,1725135160.0,MtF,11
601,1e3aaga,Shoulder reduction surgery,Ancient_Lettuce_9737,1720984142.0,MtF,3
602,1efz22f,Bottom surgery consultation!,EclipsedZeref,1722359962.0,MtF,0
603,q10ran,PETITION TO ADD GENDER AFFIRMING SURGERY TO MEDICARE,Sun-Elijah,1633332931.0,MtF,32
604,1e6ybxo,Bottom surgery experiences ,DocZockMemes,1721375781.0,MtF,2
605,1etzhww,Orchiectomy pre Bottom Surgery?,zoe_phoenix,1723841196.0,MtF,1
606,1ew9vvl,Mtf (top surgery regret),ThatSickDragon,1724093728.0,MtF,0
607,1ea2sbi,"I don't like my parts, but I'm terrified of surgery",SammSandwich,1721723896.0,MtF,21
608,149uu99,I'm worried bottom surgery will be banned,extratalllesbian,1686810516.0,MtF,49
609,15nwx43,"Got bottom surgery coming up in 16 days, what should be the first thing I text my friend group when I wake up to get a laugh?",HashnaFennec,1691722996.0,MtF,184
610,1epi3wu,Help preparing for surgery,TangoJavaTJ,1723373888.0,MtF,1
611,16j6j74,I've been cloaked after passing for 4 years and 8 surgeries and I don't know how to handle it,BrokenAstraea,1694762491.0,MtF,92
612,1e9xht5,"Preparing for surgery, (hindsight 2020)",kytookay,1721704208.0,MtF,7
613,rg4i89,I had bottom surgery this past Monday with Dr. Bella Avanesian at Mt. Sinai New York City.,AryntheAnonymous,1639476982.0,MtF,129
614,1d8x4ti,Opinions on bottom surgery?,ArchonIlladrya,1717612246.0,MtF,9
615,1dl0tyo,Surgery date,iseeyoualwaays,1718965991.0,MtF,0
616,1dl33wv,"Sisters that have gotten bottom surgery, how is it (it, meaning life with the new plumbing) now? Is it better, worse, or just different? And what about sex? How has that changed?",Bratty_Briar95,1718973819.0,MtF,125
617,1d2a3ky,need reassurance regarding bottom surgery / sex in general,No_Quarter_293,1716867210.0,MtF,24
618,17jxi2o,What are the best panties to get without tucking and without surgery?,Impossible-Lime2118,1698683685.0,MtF,50
619,1d634zv,Surgery cost,SorryCartographer437,1717295094.0,MtF,2
620,1f4xsvk,Chest weights for top surgery preparation??,Apprehensive_Cry996,1725030959.0,MtF,5
621,1bdldq8,Bottom Surgery!,colette_maree,1710314235.0,MtF,8
622,1c27am3,Todays my top surgery,Gmoore6550,1712923057.0,MtF,13
623,1dy22bk,Are bottom surgery safe,Select_Duck6902,1720420444.0,MtF,4
624,1dr9zs7,Is inconvenience a valid reason for bottom surgery,Jackey3,1719663671.0,MtF,17
625,1dmp8vw,I feel like getting voice feminization surgery makes me a failure,PizzaKiller023,1719158040.0,MtF,25
626,1e3h864,Detransition because of surgery results?,Affectionate_Dish_22,1721002749.0,MtF,7
627,1csmy2v,nonbinary top surgery?,NoChard5979,1715785250.0,MtF,7
628,1dldnhg,Vocal Cord Surgery?,Mara-Sovs-Left-Thigh,1719001320.0,MtF,2
629,ssjkqg,Does anyone date trans women before hrt/affirming surgery?,idkasklater,1644868284.0,MtF,95
630,1ed5gob,How to deal with never being able to afford surgery.,Palerate2,1722046434.0,MtF,26
631,1c82st8,Bottom surgery,Electronic-Goat9807,1713548052.0,MtF,6
632,1eksmlt,Dropping hormones for Surgery,LexiiBerri,1722876328.0,MtF,0
633,193hpue,Had GRS surgery yesterday!,marli-zushi,1704917269.0,MtF,17
634,6wl0o2,"Yet another surgery to add to my list, pelvis plastic surgery.",drewiepoodle,1503942173.0,MtF,82
635,1ej5ao9,What good surprises did other girls not expect after bottom surgery? ,shadowdemon10,1722697057.0,MtF,20
636,1ec4xfb,What is sex like after surgery?,broccoliwbones08,1721938838.0,MtF,6
637,rwvcxd,I just had my first full orgasm since bottom surgery.,barelyonhere,1641412230.0,MtF,49
638,17dox7v,No dilation after surgery possible?,Musicrafter,1697964640.0,MtF,27
639,1du1fby,Advice regarding surgery,redsunsetsky,1719967356.0,MtF,0
640,1b74dt1,Omg yall I'm finally getting bottom surgery,Illiad7342,1709642854.0,MtF,24
641,1cth9af,Question bottom surgery,Possible-Park2396,1715877524.0,MtF,5
642,1elopvj,Hairline correction surgery in MA,YukonW,1722967591.0,MtF,2
643,1eqifkf,Bottom Surgery Cost and Advice,Whereismyownname,1723480579.0,MtF,1
644,1dzxndm,Negative comments/reactions after surgery,Littleputita,1720622934.0,MtF,5
645,1emyw0y,Bottom surgery w/out HRT?,JuanDifoool,1723098562.0,MtF,2
646,1csa832,Explanations for bottom surgery?,WitchwayisOut,1715740265.0,MtF,5
647,up1pi6,"It's nice that my insurance company covers bottom surgery, BUUUUUUUUUUUUUUUTTTTTTTTTTT...",N33RDB01_Jenkens,1652476752.0,MtF,76
648,1ex60jy,Sex work after bottom surgery,Medea67,1724185529.0,MtF,0
649,1ehxbjq,"Got gyno surgery but now I realize that wasn't the problem, and now I'm very SAD",Ineedtoknow777,1722561054.0,MtF,20
650,1bff43p,Feelings about bottom surgery changing?,PandaBearRen,1710512578.0,MtF,18
651,19dwgds,is it weird to not want bottom surgery,MakiMaki500,1706037647.0,MtF,40
652,1e58hbt,it is so lame that I need surgery to have a vagina!,FemFutile,1721187931.0,MtF,18
653,td6zov,Is it better to go through voice training or just get vocal surgery?,Lunarend3,1647178338.0,MtF,77
654,1e1fs47,Feeling weird about wanting to get bottom surgery,Gordon_freeman_real,1720785276.0,MtF,14
655,1efpxdx,A question about bottom surgery.,bibob_1,1722335356.0,MtF,2
656,1dplzut,Voice surgery satisfaction? Regrets?,Sigmunds-Girl-Cigar,1719475610.0,MtF,3
657,1dp33dj,Can I pass without surgery or HRT? I’m scared of the side effects.,AndyJaeven,1719419829.0,MtF,50
658,1cwoldo,Bottom Surgery Woes,r0tund_,1716234593.0,MtF,3
659,1ddnoe1,Raising money for bottom surgery ,killme_dospuntostres,1718136312.0,MtF,8
660,143mimh,I have boob implant surgery in 3 hours approximately. Wish me luck 🌈☺️,EmilySeville7cfg,1686166258.0,MtF,44
661,1dthy09,Paying for bottom surgery ,Se7en_L,1719913664.0,MtF,1
662,12kpfuw,Omg...I might actually be able to afford surgeries,noxis96,1681392923.0,MtF,40
663,18t45z5,What are some excuses to hide that you just got bottom surgery?,Background-Weight517,1703796631.0,MtF,42
664,1ep0vtv,Can I keep my testicles after surgery?,EggplantTrue5029,1723317125.0,MtF,6
665,ayrqlf,MY STATE JUST RULED THAT TRANS SURGERY IS MEDICALLY NECESSARY AND THAT MEDICARE IS REQUIRED TO COVER IT OH MY GOD,CrossfireInvader,1552060217.0,MtF,125
666,1eysx6c,I got my surgery date for my orchiectomy today!!!,IntentionGrouchy5522,1724356653.0,MtF,7
667,1dtzw68,SRS surgery and hemorrhoids,Whereismyownname,1719962860.0,MtF,1
668,11vmr2y,Going off hrt for surgery,TL_Arwen,1679235851.0,MtF,46
669,1e7jd3c,Blood on catheter after surgery?,Lilium_Vulpes,1721436727.0,MtF,2
670,1asw0xi,Minimal time on HRT before doing clevical shortening surgery(shoulder shortening surgery).,Mountain2124,1708153845.0,MtF,3
671,19eu9ij,One Surgery,Bluedogpinkcat,1706137713.0,MtF,11
672,1b82tuc,I got bottom surgery two days ago!,JJ--1991,1709739711.0,MtF,21
673,1c30uq6,Top surgery was yesterday!!,Gmoore6550,1713011455.0,MtF,7
674,1cwa6kc,Bottom Surgery Q,bedwithoutsheets,1716192028.0,MtF,2
675,1es6p1s,Does masturbating before bottom surgery improve it?,Glitchy157,1723654339.0,MtF,5
676,sx2dti,Can you feel your top after top surgery?,TooMuchSalmonella,1645367208.0,MtF,80
677,1engkzx,I'm really struggling with hair removal for bottom surgery,Technical-Egg-6835,1723149279.0,MtF,12
678,1du2eeo,Facial Feminization Surgery Help!,Ok-Inspector1108,1719970302.0,MtF,0
679,1dsmth7,Regarding health complications (especially from surgeries)?,Livid-Gift-4965,1719817893.0,MtF,8
680,1et2nfi,Need some relationship advice re: surgery,SadInCars,1723746728.0,MtF,1
681,zpokkw,The only thing I fear about bottom surgery.,Kampfer84,1671447661.0,MtF,63
682,o1v07c,Bottom Surgery!,Sapphire-Sarazin,1623929369.0,MtF,48
683,1cmpmsx,Flexibility after bottom surgery?,PlayerPiano42,1715123304.0,MtF,6
684,1b8yt9k,Holy shit I have a bottom surgery date on the books!!,witchgrove,1709828715.0,MtF,19
685,1ddrmdi,Just out surgery after a simple orchiectomy. Ask me anything. ,Guilty_Armadillo583,1718146377.0,MtF,23
686,1eruczq,poem about body dysmorphia? and surgery,goodgirlvhagar,1723616141.0,MtF,0
687,1ccgh3o,"Just got bottom surgery, AMA",indigo121,1714011234.0,MtF,9
688,1dvkoty,I’m extremely worried about jaw surgery,SwarmBish,1720137050.0,MtF,6
689,19aiszd,Just had top surgery here in the US. Ask me anything.,Eve_interupted,1705670039.0,MtF,45
